Agente,Descrição,Document,Link do Item,Número do Programa,Título
Chico Buarque,"Um jumento, um cachorro, uma galinha e uma gata são os personagens deste Estúdio F, que tem como tema as músicas feitas por Chico Buarque para a história dos Saltimbancos.",42428,https://www.funarte.gov.br/estudio-f/estudio-f-chico-buarque-para-as-criancas/,194,194 - Chico Buarque para as crianças
Braguinha,"Quem se lembra das divertidas histórias de Chapeuzinho Vermelho e a Dona Baratinha e quem dançou marchinhas de carnaval, como Pirata da Perna de Pau e Tem Gato na Tuba, vai se esbaldar nesta edição do Estúdio F. O tema vai ser a obra infantil de Braguinha, nosso homenageado especial, que tantas músicas e histórias compôs para a gurizada.",43144,https://www.funarte.gov.br/estudio-f/estudio-f-era-uma-vez-braguinha/,196,196 - Era uma vez Braguinha
Heitor Villa-Lobos,"Sambalelê tá doente e Pai Francisco entrou na roda tocando seu violão, enquanto o cravo brigava com a rosa debaixo de uma sacada. Essas e outras cantigas de roda do folclore brasileiro estão neste Estúdio F,  que homenageia o universo infantil na obra do maestro Heitor Villa-Lobos. É nessa terça, às 20h, aqui na Rádio Nacional.",46153,https://www.funarte.gov.br/estudio-f/estudio-f-o-folclore-e-as-cantigas-do-brasil-por-heitor-villa-lobos/,197,197 - O folclore e as cantigas do Brasil por Heitor Villa-Lobos
Linda Batista,"Na fumaça das boates cariocas, ao som das roletas dos grandes cassinos ou em nuvens de confete e serpentina dos bailes de carnaval, ela reinou absoluta. Estamos falando de LINDA BATISTA, primeira rainha do rádio, em 1937, recoroada nos dez anos seguintes. É ela a nossa homenageada nesta edição do Estúdio F.",160030,https://www.funarte.gov.br/estudio-f/estudio-f-linda-batista/,202,202 - Linda Batista
Marlene,"“A maior”, “A favorita da Aeronáutica”, “A que canta e dança diferente”, “Aquela que não perde a majestade”. Vários títulos que podem ser traduzidos em um só nome: Marlene, a cantora que brilhou na era de ouro do rádio e nunca deixou de se reinventar. É ela a personagem deste Estúdio F.",46162,https://www.funarte.gov.br/estudio-f/estudio-f-marlene/,201,201 - Marlene
Sérgio Sampaio,"Foi pelas mãos de Raul Seixas que ele entrou para a CBS, mas logo faria carreira independente e ganharia o rótulo de maldito. Mesmo assim, seu séquito de fãs é fiel e crescente. A trajetória de Sérgio Sampaio está neste Estúdio F.",46159,https://www.funarte.gov.br/estudio-f/estudio-f-sergio-sampaio-2/,199,199 - Sérgio Sampaio
Pedro Caetano,"“Onde estão os tamborins”, “Botões de laranjeira”, “Caprichos do destino” e outros grandes sucessos da era de ouro do rádio. É com as grandes composições de Pedro Caetano que o Estúdio F vai sambar até cair no chão.",46156,https://www.funarte.gov.br/estudio-f/estudio-f-pedro-caetano/,198,198 - Pedro Caetano
Emilinha Borba,"Quando o radialista César de Alencar anunciava seu nome, o auditório vinha abaixo. Também não era para menos, afinal ela era a maior! Emilinha Borba, um dos maiores fenômenos de popularidade da história da música brasileira, rainha do rádio, favorita da marinha e dos gays é a personagem deste Estúdio F.",46609,https://www.funarte.gov.br/estudio-f/estudio-f-emilinha-borba/,200,200 - Emilinha Borba
Leny Eversong,"Dona de uma voz comparada à grandeza do Rio Amazonas, Leny Eversong foi uma das intérpretes mais impressionantes de nossa música. A história dessa diva conhecida pela versatilidade em vários idiomas é o tema deste Estúdio F.",160033,https://www.funarte.gov.br/estudio-f/estudio-f-leny-eversong/,203,203 - Leny Eversong
Lobão,"Polêmico e vivendo dez anos a mil, Lobão derruba casinhas e dispara sua metralhadora giratória nessa edição do Estúdio F. Na pauta, suas histórias e sucessos como ""Me chama"", ""Rádio Blá"" e ""Corações psicodélicos"".",48175,https://www.funarte.gov.br/estudio-f/estudio-f-lobao/,209,209 - Lobão
Marcelo Nova,"Irreverente, inconveniente, agressivo, franco, marginal... Acompanhado de sua banda, o Camisa de Vênus, ou se apresentando em parceria com Raul Seixas, o baiano Marcelo Nova tornou-se protagonista na história do rock brasileiro. É ele o homenageado dessa edição do Estúdio F, que traz grandes sucessos como Eu não matei Joana D'Arc e Simca Chambord.",48232,https://www.funarte.gov.br/estudio-f/estudio-f-marcelo-nova-2/,208,208 - Marcelo Nova
Emílio Santiago,"De estudante de direito a intérprete de sucesso, a trajetória de Emílio Santiago está em cartaz no Estúdio F.",50634,https://www.funarte.gov.br/estudio-f/estudio-f-emilio-santiago/,212,212 - Emílio Santiago
Júlio Barroso,"Pai da new wave brasileira, o cantor e compositor Júlio Barroso e sua selva colorida e anárquica são temas desta edição do Estúdio F.",51468,https://www.funarte.gov.br/estudio-f/estudio-f-julio-barroso/,211,211 - Júlio Barroso
Titãs,"Com fidelidade absoluta ao ideal mosqueteiro do “um por todos, todos por um”, foi em 1982 que os Titãs começaram a soltar seus primeiros petardos. A carreira e os grandes sucessos dos gigantes mitológicos do rock brasileiro estão nesta edição do Estúdio F.",51471,https://www.funarte.gov.br/estudio-f/estudio-f-titas/,214,214 - Titãs
Paralamas do Sucesso,"Power trio do rock nacional, os Paralamas do Sucesso se reinventaram ao longo de sua história e desde os primeiros acordes, no início da década de 80, vêm honrando o próprio nome no topo das paradas musicais. O ska, o rock e o reggae de Herbet, Bi e Barone são o tema deste Estúdio F.",51487,https://www.funarte.gov.br/estudio-f/estudio-f-paralamas-do-sucesso/,213,213 - Paralamas do Sucesso
Blitz,"Ok, você venceu. Batata frita. A trajetória da Blitz, primeira banda do novo rock brasileiro surgido nos anos de 1980, está em cartaz no Estúdio F.",51840,https://www.funarte.gov.br/estudio-f/estudio-f-blitz-2/,216,216 - Blitz
Barão Vermelho,"Com letras que têm muito a dizer, o Barão Vermelho marcou gerações e conquistou hordas de fãs. A trajetória dessa banda rock n’ roll está nessa edição do Estúdio F, com grandes sucessos como “Pro dia nascer feliz”, “Maior abandonado” e “O poeta está vivo”.",51856,https://www.funarte.gov.br/estudio-f/estudio-f-barao-vermelho/,215,215 - Barão Vermelho
Kid Abelha,"Com letras que marcaram gerações, o Kid Abelha emplacou vários sucessos e conquistou muitos fãs. A trajetória dessa banda está nessa edição do Estúdio F, que traz grandes sucessos como “Pintura íntima”, “Fórmula do amor”, “Grand’ hotel”, “Amanhã é 23” e “Educação sentimental II”.",52713,https://www.funarte.gov.br/estudio-f/estudio-f-kid-abelha/,218,218 - Kid Abelha
Celso Blues Boy,"A guitarra endiabrada e a voz calibrada por incontáveis noites enfumaçadas estão nesta edição do Estúdio F, que presta homenagem ao pai do blues no Brasil, o grande Celso Blues Boy.",160289,https://www.funarte.gov.br/estudio-f/estudio-f-celso-blues-boy/,210,210 - Celso Blues Boy
Bide | Marçal,"Alcebíades Barcelos vinha do bairro carioca do Estácio. Armando Marçal, de Ramos. Juntos, compuseram grandes sucessos carnavalescos nas décadas de 1930 e 40, como Agora é cinza, A primeira vez, Que batefundo é esse e Barão das cabrochas. Essas e outras composições da dupla dinâmica do samba são as atrações desta edição do Estúdio F.",53734,https://www.funarte.gov.br/estudio-f/estudio-f-bide-e-marcal/,219,219 - Bide e Marçal
Rosana Toledo,"Rainha do rádio em Belo Horizonte, Rosana Toledo saiu de Minas Gerais para conquistar o Brasil com um repertório que vai do samba-canção à bossa-nova. A trajetória da cantora de voz acariciante está em cartaz no Estúdio F.",160282,https://www.funarte.gov.br/estudio-f/estudio-f-rosana-toledo/,220,220 - Rosana Toledo
Haroldo Barbosa,"Autor, compositor, humorista, radialista e boêmio. O carioquíssimo Haroldo Barbosa é o personagem em destaque no programa Estúdio F.",56977,https://www.funarte.gov.br/estudio-f/estudio-f-haroldo-barbosa/,226,226 - Haroldo Barbosa
Bidu Sayão,"Ela saiu do Rio de Janeiro para se tornar o maior nome do canto lírico brasileiro em todo o mundo. A trajetória de Bidu Sayão, a soprano  com voz de cristal, está em cartaz no programa Estúdio F.",104690,https://www.funarte.gov.br/estudio-f/estudio-f-bidu-sayao/,225,225 - Bidu Sayão
Paulo da Portela,"Ele se chamava Paulo Benjamin de Oliveira e ganhava a vida como lustrador. Mas, para o mundo do samba, era Paulo da Portela – um herói carioca que, em menos de 50 anos de vida, defendeu os sambistas do preconceito e, de seu sonho, criou simplesmente uma escola de samba.",57239,https://www.funarte.gov.br/estudio-f/estudio-f-paulo-da-portela/,222,222 - Paulo da Portela
Cristina Buarque,"Grandes sambas portelenses, outros do Café Nice e muitas outras relíquias estão nesta edição do Estúdio F, que relembra a trajetória e o repertório primoroso da cantora Cristina Buarque.",57256,https://www.funarte.gov.br/estudio-f/estudio-f-cristina-buarque/,223,223 - Cristina Buarque
Haroldo Lobo,"Alá-lá-ô, Índio quer apito, Pra seu governo, Tristeza... Esses e outros grandes sucessos de carnaval estão no repertório do Estúdio F, que presta homenagem ao compositor Haroldo Lobo.",57270,https://www.funarte.gov.br/estudio-f/estudio-f-haroldo-lobo/,224,224 - Haroldo Lobo
Paulo Sérgio,"Apesar de semelhanças de estilo e timbre com Roberto Carlos, Paulo Sérgio imprimiu sua própria marca e conquistou uma legião de ardorosos fãs. A trajetória desse grande ídolo romântico está em cartaz no Estúdio F.",57798,https://www.funarte.gov.br/estudio-f/estudio-f-paulo-sergio/,227,227 - Paulo Sérgio
Os Cariocas,"Conjunto vocal mais antigo em atividade na música brasileira, Os Cariocas são um capítulo e tanto na história da música brasileira, com grandes sucessos na era de ouro do rádio, na fase do baião, na bossa nova e depois dela. Seus arranjos modernos e o timbre inconfundível de suas vozes estão no Estúdio F.",61153,https://www.funarte.gov.br/estudio-f/estudio-f-os-cariocas/,228,228 - Os Cariocas
Silas de Oliveira,"Gênero musical tão antigo quanto as escolas de samba, o samba-enredo é a principal atração deste Estúdio F, que tem como homenageado o grande Silas de Oliveira – craque do Império Serrano e da música popular brasileira.",61163,https://www.funarte.gov.br/estudio-f/estudio-f-silas-de-oliveira/,229,229 - Silas de Oliveira
MPB4,"“Roda viva”, “Amigo é pra essas coisas”, “Cicatrizes” e outros grandes sambas estão nesta edição do Estúdio F, que tem como homenageado o MPB-4.",61174,https://www.funarte.gov.br/estudio-f/estudio-f-mpb4/,231,231 - MPB4
Wilson Moreira,"Seus sambas e jongos são como goiabada cascão em caixa: “coisa fina, sinhá, que ninguém mais acha”. Estamos falando de Wilson Moreira, grande compositor homenageado neste Estúdio F.",61181,https://www.funarte.gov.br/estudio-f/estudio-f-wilson-moreira/,232,232 - Wilson Moreira
Ultraje a Rigor,"Contrariando o estereótipo do paulista sério e usando o humor para fazer críticas político-sociais, a banda Ultraje a Rigor invade a praia do Estúdio F, com direito a farofa e galinha.",61324,https://www.funarte.gov.br/estudio-f/estudio-f-ultraje-a-rigor/,221,221 - Ultraje a Rigor
Waldir Azevedo,"Waldir Azevedo conquistou inúmeros fãs e alcançou um estrondoso sucesso no Brasil e no exterior. A trajetória do rei do cavaquinho está nessa edição do Estúdio F, que traz choros como “Delicado”, “Pedacinhos do céu”, “Vê se gostas” e o clássico “Brasileirinho”.",61332,https://www.funarte.gov.br/estudio-f/estudio-f-waldir-azevedo/,233,233 - Waldir Azevedo
Frenéticas,"Seis garçonetes-cantoras recrutadas pelo jornalista Nelson Motta abriram asas, soltaram feras e, assim, marcaram pontos para a presença feminina na MPB. Elas são as Frenéticas, cuja história está em cartaz no Estúdio F.",61389,https://www.funarte.gov.br/estudio-f/estudio-f-freneticas/,230,230 - Frenéticas
Jacob do Bandolim,"Genial e genioso, ele foi um dos maiores defensores do choro tradicional durante o reinado da bossa nova e do iê-iê-iê, criando clássicos da música popular brasileira e resgatando compositores esquecidos. O legado e a obra de Jacob do Bandolim – interpretada pelo próprio e por seus herdeiros musicais – são as principais atrações dessa edição do Estúdio F.",61470,https://www.funarte.gov.br/estudio-f/estudio-f-jacob-do-bandolim/,234,234 - Jacob do Bandolim
Anjos do Inferno,"“Brasil pandeiro”, “Rosa morena”, “Doralice”, “Nega do cabelo duro”, “Sem compromisso”... Esses outros grandes sucessos das décadas de 40 e 50 estão nessa edição do Estúdio F, que presta homenagem a um dos maiores conjuntos vocais que a música brasileira conheceu em sua história: os Anjos do Inferno, com seus arranjos endiabrados e o pistom nasal como marca registrada.",61824,https://www.funarte.gov.br/estudio-f/estudio-f-anjos-do-inferno/,235,235 - Anjos do Inferno
Fernanda Abreu,"Ela uniu o funk à disco music e, depois, ao rap e ao samba. Do B-Rock da banda Blitz a grandes sucessos como ""Rio 40 graus"" e ""Kátia Flávia"", a garota carioca Fernanda Abreu é o tema deste programa.
.",77001,https://www.funarte.gov.br/estudio-f/estudio-f-fernanda-abreu/,237,237 - Fernanda Abreu
Donga,"É impossível contar a história do samba sem falar dele: o violonista, compositor e cantor Ernesto dos Santos, o Donga, que além de ter registrado o famoso ""Pelo telefone"" (primeiro samba a fazer sucesso, em parceria com Mauro de Almeida), é um dos personagens fundamentais da trajetória da música popular brasileira.",77009,https://www.funarte.gov.br/estudio-f/estudio-f-donga/,240,240 - Donga
Demônios da Garoa,"Eles entraram para o Livro dos Recordes como o grupo mais antigo em atividade. Mostraram ao Brasil que São Paulo também tem samba, cantando - com seu português atravessado - as composições de Adoniran Barbosa e outros craques da música brasileira. Os Demônios da Garoa são o tema deste programa.",77016,https://www.funarte.gov.br/estudio-f/estudio-f-demonios-da-garoa/,241,241 - Demônios da Garoa
Ernesto Nazareth,"""Odeon"", ""Brejeiro"" e ""Apanhei-te cavaquinho"" são alguns dos números musicais deste programa, que tem como tema a vida e a obra do compositor e pianista carioca Ernesto Nazareth. Autor de uma obra fronteiriça entre o erudito e o popular, ele é considerado um dos pais do choro, sendo admirado por grandes nomes da música brasileira, como Heitor Villa-Lobos, Radamés Gnattali e Arthur Moreira Lima.",77029,https://www.funarte.gov.br/estudio-f/estudio-f-ernesto-nazareth/,238,238 - Ernesto Nazareth
Pepeu Gomes,"Considerado um dos dez maiores guitarristas do mundo, ele despontou no conjunto Novos Baianos e fez história nos palcos por onde passou e nos discos que gravou, misturando choro, rock, samba, axé e o que mais tivesse pela frente. Ele é o cantor, compositor e instrumentista Pepeu Gomes, o alquimista do som, personagem desta edição do Estúdio F.",77173,https://www.funarte.gov.br/estudio-f/estudio-f-pepeu-gomes/,253,253 - Pepeu Gomes
Tom Zé,"Um dos fundadores do tropicalismo, inventor de instrumentos, poeta e artista dos sons e das palavras. Sua produção inteligente, cheia de significados, conquistou a crítica e o público internacional. Redescoberto em solo brasileiro, hoje ele é consagrado como um cantor e compositor popular à frente de seu tempo: Tom Zé.",77037,https://www.funarte.gov.br/estudio-f/estudio-f-tom-ze/,242,242 - Tom Zé
Monarco,"""Quitandeiro"", ""Passado de glória"", ""Tudo menos amor"" e ""Vai vadiar"" são alguns dos sucessos que estão nesta edição do Estúdio F, que presta homenagem ao cantor e compositor Monarco, líder da Velha Guarda da Portela e grande contador de histórias da escola de Oswaldo Cruz. Paulo da Portela, Paulinho da Viola e Zeca Pagodinho são alguns dos personagens dessas histórias.",77176,https://www.funarte.gov.br/estudio-f/estudio-f-monarco/,254,254 - Monarco
Reginaldo Rossi,"Ele ficou conhecido nacionalmente por cantar o amor às mulheres e o pesar das traições. Pernambucano e romântico, era especialista em abrir seu coração sem reservas. A vida, a obra e a originalidade do cantor e compositor Reginaldo Rossi, o Rei do Brega, são o tema desta edição do Estúdio F.",77044,https://www.funarte.gov.br/estudio-f/estudio-f-reginaldo-rossi/,239,239 - Reginaldo Rossi
Arthur Moreira Lima,"De Chopin a Pixinguinha, de Mozart a Luiz Gonzaga, de Tchaisokvy a Villa-Lobos, de Liszt a Ernesto Nazareth. É vasto e eclético o repertório de Arthur Moreira Lima, pianista carioca que é o personagem deste programa, com histórias que vão do talento despontado na adolescência às longas temporadas vividas na Europa e ao caminhão-palco com o qual percorreu o interior do Brasil.",77182,https://www.funarte.gov.br/estudio-f/estudio-f-arthur-moreira-lima/,256,256 - Arthur Moreira Lima
Quarteto em Cy,"Do interior da Bahia para o mundo, elas foram personagens centrais da bossa nova, da era dos festivais e da música popular brasileira criada a partir da década de 1960, gravando sucessos de Chico Buarque, Vinicius de Moraes, Baden Powell e outros mestres da canção. Quatro cantoras que, agrupadas com o nome de Quarteto em Cy, têm sua história contada neste programa.",77053,https://www.funarte.gov.br/estudio-f/estudio-f-quarteto-em-cy/,243,243 - Quarteto em Cy
Chitãozinho & Xororó,"Nascidos no interior do Paraná, com os nomes de José e Durval, os irmãos Lima tiveram fé no próprio talento e ganharam o mundo, tornando-se uma das duplas sertanejas mais populares do Brasil inteiro. Essa e outras histórias estão nesta edição do Estúdio F, que traz a biografia e a discografia desses dois cantores conhecidos por nomes de pássaros: Chitãozinho &amp; Xororó.",77185,https://www.funarte.gov.br/estudio-f/estudio-f-chitaozinho-xororo/,257,257 - Chitãozinho & Xororó
Dircinha Batista,"Na famosa era de ouro do rádio, ela foi uma das maiorais. Depois de despontar como estrela mirim do programa de rádio de Francisco Alves, se firmou como grande cantora, lançando sucessos carnavalescos, clássicos do samba-canção e se tornando a cantora preferida de personalidades como Ary Barroso e o presidente Getúlio Vargas. Ela é Dircinha Batista, personagem deste programa.",77188,https://www.funarte.gov.br/estudio-f/estudio-f-dircinha-batista/,258,258 - Dircinha Batista
Genival Lacerda,"Balançando a pança, sorrindo e cantando forrós repletos de trocadilhos e duplos sentidos, ele caiu no gosto popular e levou o nome de Campina Grande por todo o Brasil. Consagrou-se como o Rei da Muganga, lançando sucessos como ""Severina Xique-Xique"" e ""Mate o véio"", entre outros. O irreverente Genival Lacerda é o personagem desta edição do Estúdio F.",77062,https://www.funarte.gov.br/estudio-f/estudio-f-genival-lacerda/,244,244 - Genival Lacerda
RPM,"Rock and roll, sintetizadores, discurso engajado, hordas de fãs histéricas e mais de três milhões de discos vendidos. Verdadeiro furacão na música brasileira da década de 1980, a história breve e muito bem sucedida do conjunto de Paulo Ricardo, Luiz Schiavon, Fernando Deluqui e Paulo Pagni é o tema desta edição do Estúdio F. Com vocês, o fenômeno RPM.",77191,https://www.funarte.gov.br/estudio-f/estudio-f-rpm/,259,259 - RPM
Luiz Peixoto,"Na história do cancioneiro romântico brasileiro, ele é o pai de todos. Personagem fundamental das histórias de grandes nomes da nossa música, como Chiquinha Gonzaga, Ary Barroso, Carmen Miranda e João Gilberto. Transformou a língua do povo em versos de canção, dizendo ""sempre eu te amo, nunca I love you"". Neste Estúdio F: a vida e a obra de Luiz Peixoto.",77194,https://www.funarte.gov.br/estudio-f/estudio-f-luiz-peixoto/,260,260 - Luiz Peixoto
Wagner Tiso,"Mineiro de Três Pontas, ele foi personagem central do Clube da Esquina, como integrante do conjunto Som Imaginário, como artista solo e como participante ativo dos discos dos companheiros - atuando como pianista, compositor e arranjador. As criações do maestro Wagner Tiso são as atrações desta edição do Estúdio F.",77069,https://www.funarte.gov.br/estudio-f/estudio-f-wagner-tiso/,245,245 - Wagner Tiso
Sérgio Ricardo,"Com mais de 20 discos gravados, dezenas de trilhas sonoras e quatro filmes com sua direção, ele é um dos artistas mais multifacetados da música popular brasileira. Foi pianista de boate, protagonista na era dos festivais e compositor atuante no Cinema Novo. Nesta edição do Estúdio F, conheça um pouco mais da histórias, das composições e do olhar social de Sérgio Ricardo.",77240,https://www.funarte.gov.br/estudio-f/estudio-f-sergio-ricardo/,255,255 - Sérgio Ricardo
Ronaldo Bastos,"Um dos grandes letristas da música popular brasileira, o personagem deste Estúdio F é eclético por natureza, como se pode perceber por seus parceiros: de Tom Jobim a Lulu Santos, passando por Celso Fonseca, Caetano Veloso, Milton Nascimento e todo o Clube da Esquina (do qual foi um dos expoentes). Com vocês, os versos inspirados de Ronaldo Bastos.",77077,https://www.funarte.gov.br/estudio-f/estudio-f-ronaldo-bastos/,246,246 - Ronaldo Bastos
Arrigo Barnabé,"Ele mistura música erudita com pop, linguagem teatral, rock e elementos das histórias em quadrinhos em sua obra. O resultado está em discos como ""Clara Crocodilo"", ""Tubarões voadores"" e outros lançamentos da Vanguarda Paulista - movimento que teve nele um de seus principais representantes. O som atonal e dodecafônico de Arrigo Barnabé é a atração desta edição do Estúdio F.",77083,https://www.funarte.gov.br/estudio-f/estudio-f-arrigo-barnabe/,247,247 - Arrigo Barnabé
Raphael Rabello,"Prodígio do violão surgido aos 12 anos de idade, ele começou nas rodas de choro  e depois se revelou um dos grandes violonistas da história da música brasileira. Em sua vida breve (encerrada aos 32 anos), brilhou tanto em carreira solo ou quanto acompanhando outros grandes nomes, como Clara Nunes, Ney Matogrosso e Marisa Monte. Ele é o genial Raphael Rabello.",77089,https://www.funarte.gov.br/estudio-f/estudio-f-raphael-rabello/,248,248 - Raphael Rabello
Hermínio Bello de Carvalho,"Poeta, cronista, produtor, agitador cultural e um dos maiores letristas do nosso país. Parceiro de Cartola, Paulinho da Viola, Pixinguinha e Chico Buarque, entre tantos outros craques, o personagem deste programa é Hermínio Bello de Carvalho, o criador do espetáculo 'Rosa de ouro', do Projeto Pixinguinha e de outros capítulos fundamentais na história da música brasileira.",77095,https://www.funarte.gov.br/estudio-f/estudio-f-herminio-bello-de-carvalho/,249,249 - Hermínio Bello de Carvalho
Roupa Nova,"Cleberson, Nando, Kiko, Paulinho, Ricardo e Serginho. Na música brasileira dos anos 80, difícil é encontrar uma banda que tenha emplacado mais sucessos do que eles... ""Sapato velho"", ""Clarear"", ""Anjo"", ""Whisky a go go"", ""Dona"", ""Linda demais"" e outros hits românticos que estão no repertório deste programa. O tema é o conjunto Roupa Nova.",77104,https://www.funarte.gov.br/estudio-f/estudio-f-roupa-nova/,250,250 - Roupa Nova
Lulu Santos,"Criador de grandes sucessos da música brasileira nos anos 80 e 90, o cantor, guitarrista e compositor Lulu Santos é o personagem desta edição do Estúdio F. Da banda Vímana ao Rock in Rio, das baladas ao batidão dançante, sua história é ilustrada por hits como ""O último romântico"", ""Tempos modernos"", ""Como uma onda (Zen surfismo)"" e ""Tão bem"".",77113,https://www.funarte.gov.br/estudio-f/estudio-f-lulu-santos/,251,251 - Lulu Santos
Egberto Gismonti,"Erudito e popular. Moderno e antigo. Brasileiro e cosmopolita. Sinfônico e eletrônico. Pianista, violonista e grande compositor. Da cidadezinha de Carmo (no interior do estado do Rio de Janeiro) para a era dos festivais, e dela para os palcos do mundo inteiro, o inclassificável e genial Egberto Gismonti é o personagem desta edição do Estúdio F.",77134,https://www.funarte.gov.br/estudio-f/estudio-f-egberto-gismonti/,252,252 - Egberto Gismonti
Leandro | Leonardo,"""Pense em mim"", ""Entre tapas e beijos"", ""Não aprendi a dizer adeus"" e outros grandes sucessos da música sertaneja estão nesta edição do Estúdio F, que conta a história da dupla de irmãos que, nascidos em Goianópolis (no interior de Goiás), se tornaram um dos maiores fenômenos da indústria fonográfica brasileira nas décadas de 1980 e 90.",78997,https://www.funarte.gov.br/estudio-f/estudio-f-leandro-e-leonardo/,265,265 - Leandro e Leonardo
Elba Ramalho,"Nascida na cidade paraibana de Conceição do Piancó, ela começou no teatro, passou pelo cinema e se firmou como uma das cantoras mais queridas de todo o Brasil. No repertório desta edição do Estúdio F estão ""Banho de cheiro"", ""Bate coração"", ""O meu amor"" e ""De volta pro aconchego"", entre outros grandes sucessos de sua carreira.",78976,https://www.funarte.gov.br/estudio-f/estudio-f-elba-ramalho/,261,261 - Elba Ramalho
Mauro Duarte,"Mineiro de nascimento, carioca de coração, ouvires de profissão, sambista por vocação. Da boemia do bairro carioca de Botafogo, ele se tornou compositor de sucessos de Clara Nunes (""Menino Deus"", ""Lama"" e ""Portela na avenida""), Cristina Buarque (""Reserva de domínio"") e João Nogueira (""Um ser de luz""), entre outros grandes cantores de samba.",78988,https://www.funarte.gov.br/estudio-f/estudio-f-mauro-duarte/,262,262 - Mauro Duarte
