,Título
0,Estão abertas as inscrições para o Painel Funarte de Bandas de Música em Jaguaribe (CE)
1,Poemas de Portinari: a outra faceta do grande pintor é tema do novo livro da Funarte
2,Booktrailer: lançamento da Funarte reúne a obra de Benjamim Santos dedicada às crianças
3,Teatro infantil: Benjamim Santos segundo a contadora de histórias e escritora Bia Bedran
4,"Teatro Infantil: o 'livro da vida de Benjamim Santos', segundo o professor Weslley Fontenele"
5,Teatro Infantil: dramaturgo Benjamim Santos destaca a importância da criança em sua obra
6,Bonecos em cartaz no Teatro Dulcina
7,"Book trailer do livro “O uso criativo de acervos fotográficos”, de Pedro Karp Vasquez"
8,'Sete gatos pardos' volta ænbsp; Funarte SP
9,Painel Funarte de Bandas chega a BH
10,Brasília recebe exposição 'Pequenas escalas'
11,Solo de dança 'A pequena morte' é atração em SP e Rio
12,Acervo Sergio Britto Digital
13,Teatro de Arena: história e programação no Centro de SP
14,Dança do passinho e 'street dance' de Nova York se encontram no Cacilda Becker
15,"Teaser da peça ""Dani Night: solteira, procura"""
16,"Peça ""Gisberta"", com Luis Lobianco, é atração no Dulcina"
17,Ensaios Brasileiros Contemporâneos: booktrailer 'Psicanálise'
18,Book trailer do livro “Coleção Ensaios Brasileiros Contemporâneos – Música”
19,"Book trailer do livro “O Teatro do Estudante do Brasil de Paschoal Carlos Magno”, de Fabiana Fontana"
20,"Book trailer do livro ""Coleção Ensaios Brasileiros Contemporâneos – Indisciplinares"""
21,Vozes da Funarte SP
22,Projeto Bandas de Música da Funarte
23,'Transição de fase' é atração na Funarte MG
24,Silas de Oliveira
25,Clássico de Ionesco em cartaz no Dulcina
26,"""Conexão Dança Ceará-Rio"""
27,Book trailer do livro “Arquivos e coleções privados Cedoc/Funarte: guia geral”
28,Ensaios Brasileiros Contemporâneos: booktrailer 'Literatura'
29,Orlando Miranda: homem de teatro
30,Book trailer do livro “Coleção Ensaios Brasileiros Contemporâneos – Cidades”
31,Francisco Brennand: um viva aos 90!
32,Booktrailer: “Luiz Carlos Mendes Ripper: poesia e subversão”
33,"Teatro Dulcina recebe a comédia ""Favela 2"""
34,Geraldo Pereira entre amigos
35,"Book trailer do livro “Teatro Duse: o primeiro teatro-laboratório do Brasil”, de Diego Molina"
36,"Book trailer do livro “Stanislávski: vida, obra e sistema”, de Elena Vássina e Aimar Labaki"
37,Vozes da Funarte SP
38,Conheça o projeto Funarte Digital
39,"Funarte Musical leva shows a BH, Rio e SP"
40,Funarte SP recebe exposição 'Mãe Preta'
41,Entrevista com Marília Librandi Rocha
42,O teatro completo de Plínio Marcos
43,'O Pequeno Príncipe Preto'
44,Bibi Ferreira em primeira pessoa
45,Teatros multiconfiguracionais
46,Escola Nacional de Circo: 35 anos
47,"Teaser da peça ""Estudo para Missa para Clarice"""
48,Iberescena 2018-2019: inscrições abertas
49,"Em breve, no Teatro Glauce Rocha: ""T.R.A.N.S."""
50,Ensaios Brasileiros Contemporâneos: booktrailer 'Artes Visuais'
51,Ensaios Brasileiros Contemporâneos: booktrailer 'Política'
52,Ensaios Brasileiros Contemporâneos: booktrailer 'Filosofia'
53,"Book trailer do livro “O Rio de Ernesto Nazareth”, de Beth Ritto"
54,Balé com entrada franca no Cacilda Becker
55,"Em cartaz, na Funarte Brasília: ""Remanso"""
56,Carolina Maria de Jesus: Diário de Bitita
57,"Book trailer do livro “Memória a dois”, de Paulo Brito e Sérgio Britto"
58,Book trailer do livro “Coleção Ensaios Brasileiros Contemporâneos – Problemas de Gênero”
59,Lembranças de Drummond
60,Funarte Brasília recebe Cena Universitária Nacional
61,Teatro Cacilda Becker: danças de matriz africana são as atrações de novembro
62,"""Crimes delicados"" volta ao Dulcina"
63,Luteria: histórias de quem faz instrumentos musicais
64,Homenagem a Luiz Olimecha
65,Memória Musical Funarte: Zé Luiz canta e conta o Império Serrano
66,Memória Musical Funarte: Maria Teresa Madeira toca e conta Chiquinha Gonzaga
67,Hélio Oiticica
68,Memória Musical Funarte: Nelson Sargento canta e conta a Mangueira
69,Memória Musical Funarte: Monarco canta e conta a Portela
70,Memória Musical Funarte: Marcelo Caldi canta e conta Luiz Gonzaga
71,Funarte São Paulo Lulu Librandi
72,Memória Musical Funarte: João Roberto Kelly canta e conta as marchinhas de carnaval
73,Memória Musical Funarte: Henrique Cazes toca e conta Waldir Azevedo
74,Memória Musical Funarte: Leandro Souto Maior canta e conta o rock brasileiro
75,"Estúdio F, 10 anos"
76,Memória Musical Funarte: Déo Rian toca e conta Jacob do Bandolim
77,Memória Musical Funarte: Casuarina canta e conta Sidney Miller
78,Um papo sobre Ariano Suassuna
79,Pixinguinha 120
