,Abrangência/ Cobertura,Assunto/ palavras-chave,Autor,Data,Descrição,Identifier,Título
523,,10 Comunicação > 10.1 Documento,Não identificado,1957,,1980.16.169,Fotografia||Villa-Lobos trabalhando em uma de suas partituras
524,,10 Comunicação > 10.1 Documento,Não identificado,1957,,1980.16.168,Fotografia||Villa-Lobos trabalhando em uma de suas partituras
525,,10 Comunicação > 10.1 Documento,Não identificado,1957,,1980.16.082,Fotografia||Villa-Lobos e acordeonista não identificada
526,,10 Comunicação > 10.1 Documento,Não identificado,1957,,1980.16.079,"Fotografia||Villa-Lobos, Arminda, Rose Singer e não identificada"
527,,10 Comunicação > 10.1 Documento,Não identificado,1957,Anotação manuscrita no verso “Acompanhando Aracy Belos Campos em Nhapopé em N. York recepção em sua homenagem...”,1980.16.070,Fotografia||Villa-Lobos fumando charuto e tocando piano e Walter Burle Marx na residência dos amigos N. Singer
528,,10 Comunicação > 10.1 Documento,Não identificado,1957,,1977.16.288,"Fotografia||Villa-Lobos tocando piano, Walter Burle Marx, de óculos, e Asdrubal Lima na residência dos amigos Singer"
529,EUA > Nova York,10 Comunicação > 10.1 Documento,Não identificado,1957,"Com Arminda, Dora Vasconcellos (atrás, entre Villa-Lobos e Arminda), Sr. e Sra. Jayme de Barros (ela atrás de chapéu preto, ele o último à esq. na foto) e outros não identificados",1977.16.174,"Fotografia||Villa-Lobos, após receber a ‘Proclamação’ do Prefeito da cidade de Nova York"
530,,10 Comunicação > 10.1 Documento,Não identificado,1957,"À esquerda, com a mão sobre a bandeira de São Paulo o Sr. Goffredo da Silva Telles Junior. ",1985.16.002,"Fotografia||Villa-Lobos e Arminda na inauguração de uma placa no Teatro Municipal de São Paulo, durante a Semana Villa-Lobos"
531,,10 Comunicação > 10.1 Documento,Não identificado,1957,,1982.16.199,"Fotografia||Villa-Lobos, por ocasião da entrega do título “Cidadão de São Paulo”, concedido pela Câmara Estadual de São Paulo, durante a Semana Villa-Lobos, realizada em comemoração aos seus 70 anos"
532,,10 Comunicação > 10.1 Documento,Não identificado,1957,,1982.16.183,"Fotografia||Goffredo da Silva Telles Junior entre Villa-Lobos e a Sra. Goffredo da Silva Telles por ocasião da inauguração de uma placa no Theatro Municipal de São Paulo, como parte das comemorações da Semana Villa-Lobos"
533,,10 Comunicação > 10.1 Documento,Não identificado,1957,,1982.16.177,Fotografia||Villa-Lobos entre não identificados. Semana Villa-Lobos
534,,10 Comunicação > 10.1 Documento,Não identificado,1957,"Da dir. para esq.: Alexandre Schaffman, Calixto Corazza, Gino Alfonsi, Villa-Lobos e Johanes Oelsner. Semana Villa-Lobos. Manuscrito no verso “bilhete anexo à reprodução: Ana Stella Schic promoveu esta semana”.",1982.16.083,Fotografia||Villa-Lobos e o Quarteto São Paulo (cordas)
535,,10 Comunicação > 10.1 Documento,Não identificado,1957,"Da dir. para esq.: Alexandre Schaffman, Calixto Corazza, Gino Alfonsi, Villa-Lobos e Johannes Oelsner. Semana Villa-Lobos. Manuscrito no verso “bilhete anexo à reprodução: Ana Stella Schic promoveu esta semana”. ",1982.16.082,"Fotografia||Villa-Lobos e o Quarteto São Paulo (Haydn), de cordas, durante a Semana Villa-Lobos"
536,,10 Comunicação > 10.1 Documento,Não identificado,1957,,1982.16.064,"Fotografia||Villa-Lobos e Julieta Strutt, última à direita, com um grupo de crianças e jovens na inauguração do Conservatório Villa-Lobos. Semana Villa-Lobos"
537,,10 Comunicação > 10.1 Documento,Não identificado,1957,"Da dir. para esq., sentados: Octacílio Braga (1º), Arminda (2ª), Villa-Lobos (4º), João Batista Julião (5º); de pé: Julieta Strutt (1ª), Roberto Strutt (3º) e Otávio Vieira Brandão (5º).Obs: No verso, encontra-se carimbado “Jayro Marcondes. 9-9623 - S. Paulo”",1980.16.095,"Fotografia||Almoço oferecido pelo maestro João Batista Julião (calvo, sentado à mesa) por ocasião de uma festividade do Conservatório de Música, na Semana Villa-Lobos"
538,,10 Comunicação > 10.1 Documento,Não identificado,1957,,1980.16.080,Fotografia||Villa-Lobos regendo orquestra e a soprano Magdalena Lébeis na 1ª audição do “Poema de Itabira”. Semana Villa-Lobos
539,,10 Comunicação > 10.1 Documento,Não identificado,1957,"Da dir. para esq.: Souza Lima (de sobretudo e óculos com aro escuro), Marguerite Long (de boina), Villa-Lobos, Goffredo da Silva Telles Junior (de terno risca de giz, ao lado de VL), Profa Ercília, Octacílio Braga (de óculos com aro escuro), a pianista Anna-Stella Schic.",1977.16.261,Fotografia||Semana Villa-Lobos
540,,10 Comunicação > 10.1 Documento,Não identificado,1957,,1977.16.183,Fotografia||Villa-Lobos regendo na Rádio Gazeta
541,,10 Comunicação > 10.1 Documento,Não identificado,1957,,1977.16.181,Fotografia||Villa-Lobos com o musicólogo Rossini Tavares de Lima
542,,10 Comunicação > 10.1 Documento,Não identificado,1957,,2003.16.054,"Fotografia||25º aniversário da SEMA - Superintendência de Educação Musical e Artística. Lucília Villa-Lobos, 1ª sentada à esquerda, atrás, no canto direito José Vieira Brandão, na fila intermediária, mais à esq. de terno claro Sylvio Salema"
543,,10 Comunicação > 10.1 Documento,Não identificado,1957,"Lucília Villa-Lobos, 1ª sentada à esquerda. Na fila de trás, à esq. de Lucília, de terno claro Sylvio Salema no canto direito José Vieira Brandão, na fila intermediária, mais à esquerda.",2003.16.053,Fotografia||25º aniversário da SEMA - Superintendência de Educação Musical e Artística
544,,10 Comunicação > 10.1 Documento,Não identificado,1957,,2002.16.053,"Fotografia||Villa-Lobos e José Vieira Brandão e não identificados, por ocasião da entrega da Medalha Anchieta, conferida pela Prefeitura do então Distrito Federal, em homenagem aos 70 anos do compositor"
545,,10 Comunicação > 10.1 Documento,Não identificado,1957,,1983.16.120,"Fotografia||Villa-Lobos e Arminda junto à escada de avião, no aeroporto do Galeão"
546,Brasil > Rio de Janeiro,10 Comunicação > 10.1 Documento,Não identificado,1957,"À direita, Esaú de Carvalho. Rio de Janeiro, 1957Obs: Esaú de Carvalho, irmão do maestro Eleazar, que era diretor da Rádio Educadora.",1982.16.141,"Fotografia||Villa-Lobos e Arminda desembarcando no Aeroporto do Galeão, chegando de Nova York"
547,,10 Comunicação > 10.1 Documento,Não identificado,1957,"Da dir. para esq.: Arminda (1ª), Helena Lorenzo Fernandez (2ª), Villa-Lobos (3º), Marguerite Long (4ª), Cristina Maristany (6ª).",1982.16.117,Fotografia||Homenagem a pianista Marguerite Long na Academia de Música Lorenzo Fernandez
548,,10 Comunicação > 10.1 Documento,Não identificado,1957,,1982.16.019,Fotografia||Villa-Lobos fumando charuto e jogando bilhar na Associação Brasileira de Imprensa - ABI
549,Brasil > Rio de Janeiro,10 Comunicação > 10.1 Documento,Não identificado,1957,,1977.16.322,Fotografia||Villa-Lobos fumando charuto e jogando bilhar na Associação Brasileira de Imprensa - ABI
550,,10 Comunicação > 10.1 Documento,Não identificado,1957,,1977.16.191,"Fotografia||Da dir. para esq.: Arminda (2ª), Villa-Lobos (3º), Herbert Moses (4º), Andrade Muricy (5º) e Octacílio Souza Braga (7º) - que substituía Villa-Lobos no Conservatório quando o compositor viajava - e outras pessoas não identificadas."
551,,10 Comunicação > 10.1 Documento,Não identificado,1957,,1977.16.176,Fotografia||Villa-Lobos em pose de escrever
552,,10 Comunicação > 10.1 Documento,Não identificado,1957,,2003.16.077,Fotografia||Villa-Lobos mostrando o instrumento ‘Pio’
553,,10 Comunicação > 10.1 Documento,Não identificado,1957,,1980.16.165,Fotografia||Foto de um desenho de Villa-Lobos e com assinatura do artista [Mezzadra]
554,,10 Comunicação > 10.1 Documento,Não identificado,1957,,1977.16.179,Fotografia||Villa-Lobos de terno e gravata
555,,10 Comunicação > 10.1 Documento,Não identificado,1957,,1977.16.127,"Fotografia||Villa-Lobos, René Chalan, a solista Maria Kareska e membros da orquestra"
556,Brasil > Rio de Janeiro,10 Comunicação > 10.1 Documento,Não identificado,1957,,1983.16.135,"Fotografia||Arminda (2ª), Villa-Lobos (3º), Herbert Moses (4º), Octacílio Braga (7º) e não identificados"
557,,10 Comunicação > 10.1 Documento,Não identificado,1956,,2008.16.055,"Fotografia||Villa-Lobos diante da orquestra e coro da radiodifusão francesa, agradecendo aplausos, por ocasião da 1ª audição mundial da “Sinfonia Nº 10 (Sumé Pater Patrium)”"
558,,10 Comunicação > 10.1 Documento,Não identificado,1956,,1980.16.071,Fotografia||Villa-Lobos regendo a pianista Felicja Blumental e a Orquestra Nacional da Radiodifusão Francesa durante gravação do Concerto Nº 5
559,,10 Comunicação > 10.1 Documento,Não identificado,1956,,1977.16.248,"Fotografia||Villa-Lobos e Arminda, ouvindo gravação do Descobrimento do Brasil, na sala da Pathé Marconi"
560,,10 Comunicação > 10.1 Documento,Não identificado,1956,,1977.16.247,"Fotografia||Villa- Lobos, Arminda e não identificados numa pausa da gravação de ‘Descobrimento do Brasil’"
561,França > Paris,10 Comunicação > 10.1 Documento,Não identificado,1956,"Sentados à mesa da esquerda para direita: Villa-Lobos (4º), Marguerite Long (5ª), Labieno Salgado dos Santos (6º) e Sra. (7ª), Florent Schmitt (9º), Arminda (10ª) e não identificados.Obs 1: Manuscrito no verso: “Sotero Cosme (diplomata e pintor bra) Sr. Emb. Labieno Salgado dos Santos (sentado à cabeceira da mesa) e Sra., compositor francês Florent Schimt, Madame Frederic Moreau Nino, proprietário do restaurante. Restaurante Nino em frente ao Hotel Bedford. Na entrada do rest., no bar a fotografia de VL. 1956”.",1977.16.153,"Fotografia||Jantar de despedida no restaurante Nino, em frente ao Hotel Bedford"
562,,10 Comunicação > 10.1 Documento,Não identificado,1956,,1984.16.071,"Fotografia||Villa-Lobos, no Hotel Alrae"
563,,10 Comunicação > 10.1 Documento,Não identificado,1956,,1983.16.033,Fotografia||Villa-Lobos
564,,10 Comunicação > 10.1 Documento,Não identificado,1956,,1982.16.179,Fotografia||Villa-Lobos
565,,10 Comunicação > 10.1 Documento,Não identificado,1956,,1982.16.113,Fotografia||Villa-Lobos ao piano
566,,10 Comunicação > 10.1 Documento,Não identificado,1956,"Da dir. para esq.: Walter Burle Marx, Marcos Romero e Villa-Lobos, Nova York, 1956",1977.16.245,"Fotografia||Da esquerda para direita: Walter Burle Marx, Marcos Romero e Villa-Lobos"
567,,10 Comunicação > 10.1 Documento,Não identificado,1956,,1977.16.161,"Fotografia||Arminda e Villa-Lobos, em sua mesa de trabalho"
568,,10 Comunicação > 10.1 Documento,Não identificado,1956,,1977.16.160,Fotografia||Heitor Villa-Lobos
569,,10 Comunicação > 10.1 Documento,Não identificado,1956,,1977.16.155,Fotografia||Villa-Lobos concedendo entrevista
570,,10 Comunicação > 10.1 Documento,Não identificado,1956,,1982.16.077,"Fotografia||Villa-Lobos, segurando caixa de charutos, em sua residência"
571,Brasil > Rio de Janeiro,10 Comunicação > 10.1 Documento,Não identificado,1956,,1977.16.154,Fotografia||Villa-Lobos em sua residência
572,,10 Comunicação > 10.1 Documento,Não identificado,1956,Gilson Amado (1º) e Reynaldo Reis secretário do Prefeito Negrão de Lima (sorrindo atrás de JK).,1977.16.149,Fotografia||Villa-Lobos e o presidente Juscelino Kubitschek na residência de Negrão de Lima.
573,Bélgica > Bruxelas,10 Comunicação > 10.1 Documento,Não identificado,1956,,1980.16.120,Fotografia||Villa-Lobos. Bruxelas
574,,10 Comunicação > 10.1 Documento,Não identificado,1956,,2002.16.115,Fotografia||Villa-Lobos e não identificado
575,,10 Comunicação > 10.1 Documento,Não identificado,1956,,2002.16.110,Fotografia||Folha de contato. Villa-Lobos e não identificado
576,,10 Comunicação > 10.1 Documento,Não identificado,1956,,2002.16.109,"Fotografia||Folha de contato. Villa-Lobos, Arminda e não identificado"
577,,10 Comunicação > 10.1 Documento,Não identificado,1956,,2002.16.108,"Fotografia||Folha de contato. Villa-Lobos, Arminda e não identificados"
578,,10 Comunicação > 10.1 Documento,Não identificado,1956,,1982.16.133,Fotografia||Villa-Lobos ao piano
579,,10 Comunicação > 10.1 Documento,Não identificado,1956,,1982.16.131,"Fotografia||Villa-Lobos, “The Nutcracker” (“O Quebra-Nozes”) com arranjo de Villa-Lobos"
580,,10 Comunicação > 10.1 Documento,Não identificado,1956,,1977.16.249,Fotografia||Villa-Lobos sentado ao piano com a pianista Magdalena Tagliaferro
581,França > Paris,10 Comunicação > 10.1 Documento,Não identificado,1955,,1977.16.146,Fotografia||Villa-Lobos regendo ensaio da Orquestra da Sociedade de Concertos do Conservatório de Paris
582,,10 Comunicação > 10.1 Documento,Não identificado,1955,,2002.16.019,Fotografia||Arminda no Hotel Alrae
583,,10 Comunicação > 10.1 Documento,Não identificado,1955,,1984.16.041,"Fotografia||Villa-Lobos ao lado do compositor Edgard Varese e Senhora, com Arminda e seu sobrinho Júlio Cesar Dutra, no Hotel Alrae"
584,,10 Comunicação > 10.1 Documento,Não identificado,1955,,1980.16.126,"Fotografia||Villa-Lobos, em refeição na residência do Maestro Burle Marx"
585,,10 Comunicação > 10.1 Documento,Não identificado,1955,,1980.16.076,Fotografia||Villa-Lobos no intervalo do concerto em que regeu a Orquestra da Filadélfia (Philadelphia Orchestra)
586,,10 Comunicação > 10.1 Documento,Não identificado,1955,,2003.16.074,"Fotografia||Villa-Lobos, Camargo Guarnieri e a esposa Lavínia, Lucilia, Guigui, a menina, e Mário, filho de Guarnieri"
587,,10 Comunicação > 10.1 Documento,Não identificado,1955,,1977.16.150,"Fotografia||Villa-Lobos, em sua residência, com o compositor Walter Burle Marx, sentado de perfil, e o jornalista Luciano Carneiro, de pé"
588,,10 Comunicação > 10.1 Documento,Não identificado,1955,,1983.16.068,Fotografia||Villa-Lobos e a Orquestra Filarmônica de Viena
589,,10 Comunicação > 10.1 Documento,Não identificado,1955,,1980.16.160,Fotografia||Villa-Lobos e não identificados [intervalo do ensaio com a Orquestra Sinfônica de Viena (Wiener Symphoniker)]
590,Áustria > Viena,10 Comunicação > 10.1 Documento,Não identificado,1955,"Existem divergências nas datas anotadas no verso das fotos. Em quase todas está escrito “março de 1955”, mas no verso da foto 1982-16A-221 está manuscrito com a caligrafia de Arminda “Concerto do dia 14-3-953” e na foto 2004-16A-069 “ensaio da Orquestra de Viena (13/3/953)”, e para confirmar existe um programa do concerto de Villa-Lobos regendo a Wieneker Synfoniker, no Grosser Konzerthaus Saal (sala de concerto que aparece nas fotos) de Viena, com a data de 14-3-1953.",1980.16.149,"Fotografia||Villa-Lobos ensaiando a Orquestra Sinfônica de Viena (Wieneker Synfoniker), no Grosser Konzerthaus Saal"
591,Áustria > Viena,10 Comunicação > 10.1 Documento,Não identificado,1955,,1977.16.273,"Fotografia||Villa-Lobos e Felicja Blumental no concerto com a Orquestra Sinfônica de Viena (Wiener Symphoniker), na Grosse Musikvereinssaal"
592,,10 Comunicação > 10.1 Documento,Não identificado,1955,,1983.16.098,"Fotografia||Arminda, Dora Vasconcelos, não identificado e Villa-Lobos"
593,,10 Comunicação > 10.1 Documento,Não identificado,1955,,1977.16.246,Fotografia||Villa-Lobos e o compositor francês Edgard Varèse
594,,10 Comunicação > 10.1 Documento,Não identificado,1954,,1977.16.272,"Fotografia||Villa-Lobos, a cantora Maria Kareska e Arminda, ao fundo, no irtervalo da gravação de “Invocação em Defesa da Pátria”, na Pathé Marconi"
595,,10 Comunicação > 10.1 Documento,Não identificado,1954,,1980.16.166,Fotografia||Villa-Lobos recebendo título Doutor Honoris Causa na Universidade de Miami (Miami University)
596,,10 Comunicação > 10.1 Documento,Não identificado,1954,,1982.16.137,"Fotografia||Villa-Lobos em sua residência à Rua Araújo Porto Alegre, 56 ap. 54, apontando para fotos"
597,Brasil > Rio de Janeiro,10 Comunicação > 10.1 Documento,Não identificado,1954,"Da dir. para esq.: Villa-Lobos, Sra. Gaston Talani, Sra. Gilberto Freire, o musicólogo Gaston Talani, Arminda e o antropólogo Gilberto Freire. Sentadas no chão: Luba Vatnik e Isabela Aizin.",1977.16.125,Fotografia||Villa-Lobos e Arminda em sua residência no Rio
598,Itália > Milão,10 Comunicação > 10.1 Documento,Não identificado,1953,,1980.16.144,"Fotografia||Villa-Lobos, no Teatro Scala de Milão, regendo a orquestra do Teatro"
599,,10 Comunicação > 10.1 Documento,Não identificado,1953,,2002.16.035,Fotografia||Villa-Lobos e a cantora Íris Burguet
600,,10 Comunicação > 10.1 Documento,Não identificado,1953,,1983.16.019,Fotografia||Villa-Lobos ensaiando Orquestra de Cuba
601,,10 Comunicação > 10.1 Documento,Não identificado,1953,,1982.16.016,Fotografia||Villa-Lobos com roupa de gala
602,,10 Comunicação > 10.1 Documento,Não identificado,1953,,1980.16.119,Fotografia||Villa-Lobos após um concerto
603,,10 Comunicação > 10.1 Documento,Não identificado,1953,"Foto bipartida. Parte superior da esquerda para direita: mesa composta por embaixador Jayme de Barros (3º), Andrade Muricy (4º), Arthur Rubinstein (5º), Villa-Lobos (6º), Fructuoso Viana (8º), Tomás Terán (9º).Parte inferior: Arminda na primeira fila da plateia.",2002.16.183,"Fotografia||Homenagem da Academia Brasileira de Música ao pianista Arthur Rubinstein, Palácio da Cultura Gustavo Capanema"
604,,10 Comunicação > 10.1 Documento,Não identificado,1953,"Da dir. para esq.: Andrade Muricy (1º), Arthur Rubinstein (2º), Villa-Lobos (3º), Fructuoso Viana (5º).",2002.16.016,"Fotografia||Homenagem da Academia Brasileira de Música ao pianista Arthur Rubinstein, Palácio da Cultura Gustavo Capanema"
605,,10 Comunicação > 10.1 Documento,Não identificado,1953,,1987.16.004,Fotografia||Villa-Lobos e Arminda no Aeroporto do Galeão no embarque para uma excursão do compositor pela Europa e Estados Unidos
606,,10 Comunicação > 10.1 Documento,Não identificado,1953,,1985.16.008,"Fotografia||Villa-Lobos e Arminda por ocasião da entrega da medalha Richard Strauss, na embaixada alemã no Brasil"
607,,10 Comunicação > 10.1 Documento,Não identificado,1953,,1983.16.017,"Fotografia||Villa-Lobos e Arminda por ocasião da entrega da medalha Richard Strauss, na embaixada alemã no Brasil"
608,,10 Comunicação > 10.1 Documento,Não identificado,1953,"Da dir. para esq.: embaixador Jayme de Barros (3º), Andrade Muricy (4º), Arthur Rubinstein (5º), Villa-Lobos (6º). Palácio da Cultura Gustavo Capanema",1982.16.068,Fotografia||Homenagem da Academia Brasileira de Música ao pianista Arthur Rubinstein
609,,10 Comunicação > 10.1 Documento,Não identificado,1953,,1984.16.026,"Fotografia||Villa-Lobos, Arminda, [o maestro da Orquestra Sinfônica de Porto Alegre e o diretor da sociedade] entre outros não identificados"
610,,10 Comunicação > 10.1 Documento,Não identificado,1953,,1984.16.025,Fotografia||Villa-Lobos e [o diretor do serviço de documentação]
611,,10 Comunicação > 10.1 Documento,Não identificado,1953,,1984.16.024,"Fotografia||Villa-Lobos, de costas, e Arminda na chegada a Porto Alegre"
612,,10 Comunicação > 10.1 Documento,Não identificado,1953,,1983.16.126,Fotografia||Villa-Lobos e Arminda entre não identificados
613,,10 Comunicação > 10.1 Documento,Não identificado,1953,Com a dedicatória: ‘À Mindinha’.,1982.16.280,"Fotografia||Villa-Lobos regendo, tendo ao lado um microfone da BBC e à frente, em fotomontagem, partitura da “I Suite - For Chamber Orquestra"
614,,10 Comunicação > 10.1 Documento,Não identificado,1953,,1982.16.059,Fotografia||Villa-Lobos proferindo uma conferência na Argentina
615,,10 Comunicação > 10.1 Documento,Não identificado,1953,,1985.16.019,"Fotografia||Villa-Lobos, Arminda e o embaixador Jayme de Barros (ao lado de Arminda) entre outros não identificados em uma homenagem"
616,,10 Comunicação > 10.1 Documento,Não identificado,1953,,1983.16.097,"Fotografia||Villa-Lobos, o embaixador Jaime de Barros (esq.) e o crítico argentino Gaston Talamon entre outros não identificados"
617,,10 Comunicação > 10.1 Documento,Não identificado,1953,"A foto 1980-16A-008 tem manuscrito “A linda e pacata Pensão Mara”, encontra-se carimbado “Aesster-Berlin” e a informação “Alemanha, 1936” e VL está com este mesmo casaco.",2003.16.114,Fotografia||Villa-Lobos com casaco em padronagem “espinha de peixe” e gravata de bolinhas
618,,10 Comunicação > 10.1 Documento,Não identificado,1953,"Colado no verso um recorte de impresso como a informação “El ilustre compositor brasileño Hector Villa-Lobos en la reunión de prensa que se realizo esta mañana, despues de su ensayo com la Orquestra Sinfónica Del Estado. Junto a El aparecem su señora esposa, los professores Germán de Elizalde y Hector Ruiz Diaz y representantes de los diários”.",2003.16.111,Fotografia||Villa-Lobos e Arminda entre não identificados
619,,10 Comunicação > 10.1 Documento,Não identificado,1953,"Com a dedicatória “Recuerdo Afectuoso, A Segovia,...1953”",1995.16.023,Fotografia||Andrés Segóvia
620,,10 Comunicação > 10.1 Documento,Não identificado,1953,,1987.16.062,"Fotografia||Villa-Lobos, ao piano, e a soprano Olga Praguer Coelho"
621,Israel,10 Comunicação > 10.1 Documento,Não identificado,1952,,1980.16.128,"Fotografia||Cartão postal do Garden Hotel, em Israel"
622,,10 Comunicação > 10.1 Documento,Não identificado,1952,,2008.16.051,"Fotografia||Villa-Lobos e Arminda na residência da pianista Marguerite Long, vestida de preto, e o embaixador Louis Joxe, de perfil, em recepção oferecida pelo Quai d’Orsay, para entrega da medalha Villa-Lobos com a efígie do compositor, realizada pela gravadora Josette Coeffin e idealizada pela pintora francesa Mary Danin"
623,,10 Comunicação > 10.1 Documento,Não identificado,1952,,2002.16.071,"Fotografia||Cartaz anuciando o concerto regido por Villa-Lobos com a pianista Anna-Stella Schic, entre outros espetáculos"
624,,10 Comunicação > 10.1 Documento,Não identificado,1952,,1980.16.145,"Fotografia||Villa-Lobos e Arminda na residência da pianista Marguerite Long, em recepção oferecida pelo Quai d’Orsay, para entrega da medalha Villa-Lobos com a efígie do compositor, realizada pela gravadora Josette Coeffin e idealizada pela pintora francesa Mary Danin"
625,,10 Comunicação > 10.1 Documento,Não identificado,1952,,1980.16.067,"Fotografia||Recepção na residência da pianista Marguerite Long, em recepção oferecida pelo Quai d’Orsay, para entrega de medalha Villa-Lobos em Paris. Arminda, a pintora Mary Danin, a pianista Marguerite Long e o embaixador Louis Joxe"
626,,10 Comunicação > 10.1 Documento,Não identificado,1952,,1980.16.064,"Fotografia||Villa-Lobos, Arminda e a pianista Marguerite Long, na residência desta última, em recepção oferecida pelo Quai d’Orsay, para entrega da medalha Villa-Lobos com a efígie do compositor, realizada pela gravadora Josette Coeffin e idealizada pela pintora francesa Mary Danin"
627,,10 Comunicação > 10.1 Documento,Não identificado,1952,,1980.16.063,"Fotografia||Villa-Lobos e Arminda na residência da pianista Marguerite Long, de perfil, sendo cumprimentada pelo embaixador Louis Joxe, em recepção oferecida pelo Quai d’Orsay, para entrega da medalha Villa-Lobos com a efígie do compositor, realizada pela gravadora Josette Coeffin e idealizada pela pintora francesa Mary Danin"
628,Brasil > Rio de Janeiro,10 Comunicação > 10.1 Documento,Não identificado,1952,,1990.16.008,"Fotografia||Villa-Lobos e Arminda entre [formandos] do Conservatório Nacional de Canto Orfeônico - CNCO. De pé, na última fila, ao centro, Otávio Vieira Bradão e Florêncio de Souza"
629,Brasil > Rio de Janeiro,10 Comunicação > 10.1 Documento,Não identificado,1952,,1990.16.007,"Fotografia||Missa de formatura do Conservatório Nacional de Canto Orfeônico - CNCO, na Reitoria"
630,Brasil > Rio de Janeiro,10 Comunicação > 10.1 Documento,Não identificado,1952,"Na 1ª fila da esquerda para direita: Otávio Vieira Brandão (7º), Julieta Sttrut (8ª), na 3ª fila atrás dela José Vieira Brandão, Villa-Lobos (9º), Helena Lorenzo Fernandez (10ª), Arminda (11ª), Grazzi de Sá (12º), Asdrúbal Lima (13º), Octacílio Braga (14º).",1990.16.006,"Fotografia||Formatura do Conservatório Nacional de Canto Orfeônico - CNCO, na Reitoria"
631,Brasil > Rio de Janeiro,10 Comunicação > 10.1 Documento,Não identificado,1952,"Na 1ª fila, da esquerda para direita: José Vieira Brandão (4º), Iberê Gomes Grosso (6º), Arminda (7ª), Villa-Lobos (8º), Julieta Sttrut (9ª).",1990.16.005,Fotografia||Missa de formatura na reitoria do Conservatório Nacional de Canto Orfeônico - CNCO
632,Brasil > Rio de Janeiro,10 Comunicação > 10.1 Documento,Não identificado,1952,"De pé na última fila, ao centro, Otávio Vieira Brandão e Florêncio de Souza",1990.16.004,"Fotografia||Villa-Lobos e Arminda entre [formandos], no Conservatório Nacional de Canto Orfeônico - CNCO"
633,,10 Comunicação > 10.1 Documento,Não identificado,1952,,1987.16.043,"Fotografia||Villa-Lobos regendo o Orfeão de Professores, Coro e Orquestra Sinfônica do Theatro Municipal do Rio de Janeiro"
634,Brasil > Rio de Janeiro,10 Comunicação > 10.1 Documento,Não identificado,1952,,1984.16.032,"Fotografia||Villa-Lobos, Helena Lorenzo Fernandez entregando o troféu a Laura Dale Pinto, Arminda e Julieta Strutt entre outros não identificados. Gincana realizada no encerramento do ano letivo no Conservatório Nacional de Canto Orfeônico - CNCO"
