,Abrangência/ Cobertura,Assunto/ palavras-chave,Autor,Data,Descrição,Identifier,Título
1431,,10 Comunicação > 10.1 Documento,Não identificado,25/05/1955,,1982.16.205,"Fotografia||Villa-Lobos regendo o “Concerto Nº 5 para Piano e Orquestra” com Felicja Blumental e a Orquestra Sinfônica de Viena (Wiener Symphoniker), na Grosse Musikvereinssaal"
1432,Áustria > Viena,10 Comunicação > 10.1 Documento,Não identificado,25/05/1955,,1982.16.099,Fotografia||Villa-Lobos e Felicja Blumental no concerto com a Orquestra Sinfônica de Viena (Wiener Symphoniker) na Grosser Musikvereins-Saal
1433,Áustria > Viena,10 Comunicação > 10.1 Documento,Não identificado,25/05/1955,,1982.16.098,Fotografia||Villa-Lobos e Felicja Blumental no concerto com a Orquestra Sinfônica de Viena (Wiener Symphoniker) na Grosser Musikvereins-Saal
1434,,10 Comunicação > 10.1 Documento,Não identificado,25/05/1955,,1982.16.037,"Fotografia||Felicja Blumenthal no concerto com a Orquestra Sinfônica de Viena (Wiener Symphoniker), na Grosse Musikvereinssaal, regida por Villa-Lobos"
1435,Áustria > Viena,10 Comunicação > 10.1 Documento,Não identificado,25/05/1955,,1977.16.325,"Fotografia||Villa-Lobos com a pianista Felicja Blumental e a Orquestra Sinfônica de Viena (Wiener Symphoniker), na Grosse Musikvereinssaal quando apresentaram o “Concerto Nº 5 para Piano e Orquestra”"
1436,Áustria > Viena,10 Comunicação > 10.1 Documento,Não identificado,25/05/1955,,1977.16.143,"Fotografia||Villa-Lobos regendo o “Concerto Nº 5 para Piano e Orquestra” com Felicja Blumental ao piano e a Orquestra Sinfônica de Viena (Wiener Symphoniker), na Grosse Musikvereinssaal"
1437,Áustria > Viena,10 Comunicação > 10.1 Documento,Não identificado,25/05/1955,,1977.16.142,"Fotografia||Villa-Lobos regendo o “Concerto Nº 5 para Piano e Orquestra” com Felicja Blumental e a Orquestra Sinfônica de Viena (Wiener Symphoniker), na Grosse Musikvereinssaal"
1438,Áustria > Viena,10 Comunicação > 10.1 Documento,Não identificado,04/04/1955,"Com a dedicatória “A D. Hermenegilda saudosos pensamentos do Villa-Lobos e Arminda. Paris, 4/4/55”.",1977.16.141,Fotografia||Villa-Lobos regendo a Orquestra Sinfônica de Viena (Wiener Symphoniker)
1439,Áustria > Viena,10 Comunicação > 10.1 Documento,Não identificado,04/04/1955,"Com a dedicatória “A nossa mãezinha querida, lembranças saudosas do Villa-Lobos e Arminda. Paris, 4/4/55”.",1977.16.140,Fotografia||Villa-Lobos regendo a Orquestra Sinfônica de Viena (Wiener Symphoniker)
1440,,10 Comunicação > 10.1 Documento,Não identificado,Março de 1955,,1983.16.020,Fotografia||Villa-Lobos regendo a Orchestra de La Societé des Concerts du Conservatoire
1441,França > Paris,10 Comunicação > 10.1 Documento,Não identificado,Março de 1955,,1977.16.135,Fotografia||Villa-Lobos regendo ensaio da Orquestra da Sociedade de Concertos do Conservatório de Paris
1442,,10 Comunicação > 10.1 Documento,Não identificado,Março de 1955,,2002.16.081,"Fotografia||Villa-Lobos ensaiando a Orquestra Sinfônica de Viena, no Grosser Musikvereinssaal"
1443,,10 Comunicação > 10.1 Documento,Não identificado,Março de 1955,,2002.16.079,"Fotografia||Villa-Lobos ensaiando a Orquestra Sinfônica de Viena (Wiener Symphoniker), na Grosse Musikvereinssaal"
1444,,10 Comunicação > 10.1 Documento,Não identificado,Março de 1955,,2002.16.066,"Fotografia||Villa-Lobos ensaiando a Orquestra Sinfônica de Viena (Wiener Symphoniker), na Grosse Musikvereinssaal"
1445,,10 Comunicação > 10.1 Documento,Não identificado,Março de 1955,,1984.16.084,"Fotografia||Villa-Lobos ensaiando a Orquestra Sinfônica de Viena (Wiener Symphoniker), na Grosse Musikvereinssaal"
1446,,10 Comunicação > 10.1 Documento,Não identificado,Março de 1955,,1984.16.083,Fotografia||Villa-Lobos ensaiando a Orquestra Sinfônica de Viena (Wiener Symphoniker)
1447,,10 Comunicação > 10.1 Documento,Não identificado,Março de 1955,,1984.16.082,"Fotografia||Villa-Lobos no ensaio com a Orquestra Sinfônica de Viena (Wiener Symphoniker), na Grosse Musikvereinssaal"
1448,Áustria > Viena,10 Comunicação > 10.1 Documento,Não identificado,Março de 1955,,1982.16.057,"Fotografia||Villa-Lobos ensaiando a Orquestra Sinfônica de Viena (Wiener Symphoniker), na Grosse Musikvereinssaal"
1449,Áustria > Viena,10 Comunicação > 10.1 Documento,Não identificado,Março de 1955,,1977.16.244,"Fotografia||Villa-Lobos ensaiando a Orquestra Sinfônica de Viena (Wiener Symphoniker), na Grosse Musikvereinssaal"
1450,Áustria > Viena,10 Comunicação > 10.1 Documento,Não identificado,Março de 1955,"Existem divergências nas datas anotadas no verso das fotos. Em quase todas está escrito “março de 1955”, mas no verso da foto 1982-16A-221 está manuscrito com a caligrafia de Arminda “Concerto do dia 14-3-953” e na foto 2004-16A-069 “ensaio da Orquestra de Viena (13/3/953)”, e para confirmar existe um programa do concerto de Villa-Lobos regendo a Wieneker Synfoniker, no Grosser Konzerthaus Saal (sala de concerto que aparece nas fotos) de Viena, com a data de 14-3-1953.",1977.16.243,"Fotografia||Villa-Lobos ensaiando a Orquestra Sinfônica de Viena (Wiener Symphoniker), na Wiener Konzerthaus, Grosser Saal"
1451,Áustria > Viena,10 Comunicação > 10.1 Documento,Não identificado,Março de 1955,,1977.16.145,"Fotografia||Villa-Lobos ensaiando a Orquestra Sinfônica de Viena (Wiener Symphoniker), na Grosse Musikvereinssaal"
1452,Áustria > Viena,10 Comunicação > 10.1 Documento,Não identificado,Março de 1955,,1977.16.144,"Fotografia||Villa-Lobos ensaiando a Orquestra Sinfônica de Viena (Wiener Symphoniker), na Grosse Musikvereinssaal"
1453,Áustria > Viena,10 Comunicação > 10.1 Documento,Não identificado,Março de 1955,"Existem divergências nas datas anotadas no verso das fotos. Em quase todas está escrito “março de 1955”, mas no verso da foto 1982-16A-221 está manuscrito com a caligrafia de Arminda “Concerto do dia 14-3-953” e na foto 2004-16A-069 “ensaio da Orquestra de Viena (13/3/953)”, e para confirmar existe um programa do concerto de Villa-Lobos regendo a Wieneker Synfoniker, no Grosser Konzerthaus Saal (sala de concerto que aparece nas fotos) de Viena, com a data de 14-3-1953.",1977.16.139,"Fotografia||Villa-Lobos ensaiando a Orquestra Sinfônica de Viena (Wiener Symphoniker), na Wiener Konzerthaus, Grosser Saal"
1454,Áustria > Viena,10 Comunicação > 10.1 Documento,Não identificado,Março de 1955,"Existem divergências nas datas anotadas no verso das fotos. Em quase todas está escrito “março de 1955”, mas no verso da foto 1982-16A-221 está manuscrito com a caligrafia de Arminda “Concerto do dia 14-3-953” e na foto 2004-16A-069 “ensaio da Orquestra de Viena (13/3/953)”, e para confirmar existe um programa do concerto de Villa-Lobos regendo a Wieneker Synfoniker, no Grosser Konzerthaus Saal (sala de concerto que aparece nas fotos) de Viena, com a data de 14-3-1953.",1977.16.138,"Fotografia||Villa-Lobos ensaiando a Orquestra Sinfônica de Viena (Wiener Symphoniker), na Wiener Konzerthaus, Grosser Saal"
1455,Áustria > Viena,10 Comunicação > 10.1 Documento,Não identificado,Março de 1955,,1977.16.137,"Fotografia||Villa-Lobos ensaiando a Orquestra Sinfônica de Viena (Wiener Symphoniker), na Grosse Musikvereinssaal"
1456,Áustria > Viena,10 Comunicação > 10.1 Documento,Não identificado,Março de 1955,"Existem divergências nas datas anotadas no verso das fotos. Em quase todas está escrito “março de 1955”, mas no verso da foto 1982-16A-221 está manuscrito com a caligrafia de Arminda “Concerto do dia 14-3-953” e na foto 2004-16A-069 “ensaio da Orquestra de Viena (13/3/953)”, e para confirmar existe um programa do concerto de Villa-Lobos regendo a Wieneker Synfoniker, no Grosser Konzerthaus Saal (sala de concerto que aparece nas fotos) de Viena, com a data de 14-3-1953.",1977.16.136,"Fotografia||Villa-Lobos ensaiando a Orquestra Sinfônica de Viena (Wiener Symphoniker), na Wiener Konzerthaus, Grosser Saal, Viena"
1457,Áustria > Viena,10 Comunicação > 10.1 Documento,Não identificado,Março de 1955,,1977.16.130,Fotografia||Villa-Lobos ensaindo com a Orquestra Sinfônica de Viena (Wiener Symphoniker)
1458,,10 Comunicação > 10.1 Documento,Não identificado,24/02/1955,"Com a dedicatória “Um cafezinho da nossa querida e saudosa mãezinha, em saudação ao seu brilhante aniversário. Que se prolongue por muitos anos. O Villa-Lobos de sempre e sua cara metade Arminda. New York, 24-2-55”. Escrito a caneta no canto superior direito “Outro Brasil, não é mesmo? Beijos de nós dois. Arminda”.",2002.16.048,Fotografia||Villa-Lobos tomando café
1459,EUA > Nova York,10 Comunicação > 10.1 Documento,Não identificado,24/02/1955,"Com a dedicatória: “À nossa querida e saudosa mãezinha D. Hermenegilda, lembrança muito afetuosa dos seus dois filhos Arminda e Villa-Lobos. New York, 24/2/55”",1977.16.134,Fotografia||Villa-Lobos e Arminda em hotel em Nova York
1460,,10 Comunicação > 10.1 Documento,Não identificado,02/02/1955,"Com a dedicatória “A trinca do barulho cantando o feliz aniversário de Hermenegilda, nossa saudosa e feliz mãezinha. Villa-Lobos, Dora e Arminda. New York, 24-2-55”.",2003.16.088,"Fotografia||Villa-Lobos ao piano com Arminda e Dora Vasconcellos, à esquerda"
1461,,10 Comunicação > 10.1 Documento,Não identificado,28/01/1955,"Com a dedicatória “With Sincere Admiration from the String art Quartet (The Philadelphia Orchestra), January 28, 1955. Irwin Eisenberg, Gabriel Braverinan, (nome ilegível), Veda Reynolds”.",1984.16.014,Fotografia||Villa-Lobos entre o String art Quartet
1462,,10 Comunicação > 10.1 Documento,Não identificado,22/01/1955,,2008.16.018,Fotografia||Villa-Lobos regendo ensaio com a Orquestra da Filadélfia (Philadelphia Orchestra)
1463,,10 Comunicação > 10.1 Documento,Não identificado,22/01/1955,"Com a dedicatória “Schss... silêncio! Mindinha chega...Hoje é dia 26/7/55, vamos cantar o nosso ‘Feliz aniversário’. Viva! Eu sou o tal d’ela... Villa-Lobos”.",1982.16.132,Fotografia||Villa-Lobos regendo ensaio com a Orquestra da Filadélfia (Philadelphia Orchestra)
1464,EUA > Filadélfia,10 Comunicação > 10.1 Documento,Não identificado,22/01/1955,,1977.16.132,Fotografia||Villa-Lobos regendo ensaio com a Orquestra da Filadélfia
1465,,10 Comunicação > 10.1 Documento,Não identificado,15/01/1955,"Da esq. para dir., sentados: Andrés Segóvia (violão), Heitor Villa-Lobos, Nicanor Zabaleta (harpa).De pé: Carlos Salzedo (harpa), Arthur Cohn (maestro), Arminda, Edna Phillips (harpa), Bernardo Segall (piano) e Walter Burle Marx (compositor e maestro).",2003.16.131,"Fotografia||Durante o intervalo do ensaio com a Orquestra da Filadélfia (Philadelphia Orchestra), quando o harpista Nicanor Zabaleta foi solista"
1466,,10 Comunicação > 10.1 Documento,Não identificado,15/01/1955,"Da esq. para dir., sentados: Andrés Segóvia (violão), Heitor Villa-Lobos, Nicanor Zabaleta (harpa).De pé: Arthur Cohn (maestro), Salzedo (harpista), Arminda, Edna Phillips, Bernardo Segall (pianista) e Walter Burle Marx (compositor e maestro).",2003.16.051,"Fotografia||Durante o intervalo do ensaio com a Orquestra da Filadélfia (Philadelphia Orchestra), quando o harpista Nicanor Zabaleta foi solista"
1467,EUA > Filadélfia,10 Comunicação > 10.1 Documento,Não identificado,12/01/1955,,1977.16.133,Fotografia||Villa-Lobos ensaiando a Orquestra da Filadélfia (Philadelphia Orchestra)
1468,,10 Comunicação > 10.1 Documento,Não identificado,Janeiro de 1955,Manuscrito sobre a foto “No intervalo do ensaio da Orquestra da Filadélfia (Philadelphia Orchestra) - janeiro 1955”,2002.16.089,Fotografia||Villa-Lobos com copinho de café
1469,,10 Comunicação > 10.1 Documento,Não identificado,Janeiro de 1955,,1982.16.067,Fotografia||Villa-Lobos ensaiando a Orquestra da Filadélfia (Philadelphia Orchestra)
1470,EUA > Filadélfia,10 Comunicação > 10.1 Documento,Não identificado,Janeiro de 1955,,1977.16.131,Fotografia||Villa-Lobos ensaiando com a Orquestra da Filadélfia
1471,,10 Comunicação > 10.1 Documento,Não identificado,28/12/1954,,2004.16.078,Fotografia||Villa-Lobos e Arminda no casamento de Antonio Carlos e Maria
1472,,10 Comunicação > 10.1 Documento,Não identificado,08/11/1954,"Com a dedicatória “A Niobe Marques lembrança grata de Villa-Lobos. Rio, 8/11/54”Obs: No canto inferior direito “Harcourt. Paris”.",2001.16.001,Fotografia||Villa-Lobos
1473,,10 Comunicação > 10.1 Documento,Não identificado,21/10/1954,"Com a dedicatória “Mindinha, pensas que sou um “indu” com esta cara...não, sou teu eterno ameríndio bem selvagem do bosque tropical do nosso afeto. Teu benzinho. Villa-Lobos. Rio, 21/10/54”.",1982.16.001,Fotografia||Villa-Lobos fumando charuto
1474,,10 Comunicação > 10.1 Documento,Não identificado,11/10/1954,Com a dedicatória: “Ao Padre Guilherme Schubert lembrança grata... de Villa-Lobos. Rio 11-10-54”.,1987.16.007,Fotografia||Villa-Lobos fumando cigarro
1475,,10 Comunicação > 10.1 Documento,Não identificado,13/09/1954,"No verso, informação manuscrita “Teatro Cultura Artística. Regência Villa-Lobos. Bach - VL Fantasia para órgão (1ª audição São Paulo). Villa-Lobos Bachianas Brasileiras nº 3 (1ª audição em São Paulo).”Obs: 2: No verso, encontra-se carimbado “Atelier Fotográfico. Nico Joffe. Rua Prates, 599 - telef. 36-7715. São Paulo”.",2003.16.080,"Fotografia||Concerto de Villa-Lobos com a Orquestra Sinfônica Municipal de São Paulo, tendo como solista a pianista Felicja Blumental interpretando a Bachianas Brasileiras nº 3 para piano e orquestra, no Teatro Cultura Artística"
1476,,10 Comunicação > 10.1 Documento,Não identificado,13/09/1954,"No verso, informação manuscrita “Maître Villa-Lobos à dedier son dernier Concerto de Piano et Orchestre Nº 5 à Felicja Blumental. Premiere mondiale sera a Londres au Royal Festivall Hall sous Mr. Jean Martinon, 8 mai 1955.”Obs 2: No verso, encontra-se carimbado “Atelier Fotográfico. Nico Joffe. Rua Prates, 599 - telef. 36-7715. São Paulo”.",1982.16.127,"Fotografia||Concerto de Villa-Lobos com a Orquestra Sinfônica Municipal de São Paulo, tendo como solista a pianista Felicja Blumental interpretando a “Bachianas Brasileiras Nº 3”, no Teatro Cultura Artística"
1477,,10 Comunicação > 10.1 Documento,Não identificado,13/09/1954,,1982.16.069,"Fotografia||Concerto de Villa-Lobos com a Orquestra Sinfônica Municipal de São Paulo, tendo como solista a pianista Felicja Blumental interpretando a Bachianas Brasileiras nº 3 para piano e orquestra, no Teatro Cultura Artística"
1478,,10 Comunicação > 10.1 Documento,Não identificado,28/08/1954,,2004.16.079,Fotografia||Heitor Villa-Lobos
1479,,10 Comunicação > 10.1 Documento,Não identificado,03/08/1954,"Com a dedicatória “Ao casal Machado Villas lembrança afetuosa e amiga do Villa-Lobos. Rio, 3/8/54”.Obs 2: No canto inferior direito “Harcourt. Paris”.",1982.16.100,Fotografia||Villa-Lobos
1480,,10 Comunicação > 10.1 Documento,Não identificado,03/08/1954,"Com a dedicatória “A James Roehl lembrança grata de Villa-Lobos. Rio, 3-8-1954”Obs 2: No canto inferior direito “Harcourt. Paris”.",1982.16.097,Fotografia||Villa-Lobos
1481,,10 Comunicação > 10.1 Documento,Não identificado,03/08/1954,Com a dedicatória “À Robert J. Wayner lembrança grata de Villa-Lobos. Rio 3-8-54”.,1980.16.111,Fotografia||Villa-Lobos
1482,,10 Comunicação > 10.1 Documento,Não identificado,01/08/1954,"Com a dedicatória: “Ao Maestro Villa-Lobos e a sua dedicada esposa Arminda, com admiração e respeito pela obra e tenacidade no trabalho, exemplo e guia para nós jovens a fim de continuarmos a preservar a Cultura Nacional. . SP, 1/8/954”.",1982.16.002,Fotografia||Claudio Santoro
1483,,10 Comunicação > 10.1 Documento,Não identificado,31/07/1954,"Com a dedicatória: “Para Villa-Lobos con Arminda, um muy cariñoso abrazo de . Rio-31-7-54”.",1977.16.128,Fotografia||Tezzanka
1484,,10 Comunicação > 10.1 Documento,Não identificado,Abril de 1954,,1977.16.309,Fotografia||Villa-Lobos e Arminda no jantar oferecido pelo comandante do navio United States. Trajeto Paris-Nova York
1485,,10 Comunicação > 10.1 Documento,Não identificado,13/03/1954,"Existem divergências nas datas anotadas no verso das fotos. Em quase todas está escrito “março de 1955”, mas no verso da foto 1982-16A-221 está manuscrito com a caligrafia de Arminda “Concerto do dia 14-3-953” e na foto 2004-16A-069 “ensaio da Orquestra de Viena (13/3/953)”, e para confirmar existe um programa do concerto de Villa-Lobos regendo a Wieneker Synfoniker, no Grosser Konzerthaus Saal (sala de concerto que aparece nas fotos) de Viena, com a data de 14-3-1953.",2002.16.078,"Fotografia||Villa-Lobos ensaiando a Orquestra Sinfônica de Viena (Wieneker Synfoniker), no Grosser Konzerthaus Saal"
1486,,10 Comunicação > 10.1 Documento,Não identificado,13/03/1954,"Existem divergências nas datas anotadas no verso das fotos. Em quase todas está escrito “março de 1955”, mas no verso da foto 1982-16A-221 está manuscrito com a caligrafia de Arminda “Concerto do dia 14-3-953” e na foto 2004-16A-069 “ensaio da Orquestra de Viena (13/3/953)”, e para confirmar existe um programa do concerto de Villa-Lobos regendo a Wieneker Synfoniker, no Grosser Konzerthaus Saal (sala de concerto que aparece nas fotos) de Viena, com a data de 14-3-1953.",2002.16.076,"Fotografia||Villa-Lobos ensaiando a Orquestra Sinfônica de Viena (Wieneker Synfoniker), no Grosser Konzerthaus Saal"
1487,,10 Comunicação > 10.1 Documento,Não identificado,05/03/1954,,1982.16.228,"Fotografia||Aniversário do compositor na residência dos Singer. Villa-Lobos, Arminda e o casal Schapiro"
1488,,10 Comunicação > 10.1 Documento,Não identificado,05/03/1954,,1982.16.089,"Fotografia||Aniversário do compositor na residência do casal de amigos americanos, os Singer. Villa-Lobos e Arminda entre outros não identificados"
1489,,10 Comunicação > 10.1 Documento,Não identificado,05/03/1954,,1982.16.088,"Fotografia||Aniversário do compositor na residência do casal de amigos americanos, os Singer, na foto com Villa-Lobos e Arminda"
1490,Venezuela > Caracas,10 Comunicação > 10.1 Documento,Não identificado,06/02/1954,"Com a dedicatória “Ao Diário de La Marina. Um bom Xarrito (puro) faz-me lembrar Cuba. E eu fumo todos os dias e para sempre. Caracas, 6-12-54. H. Villa-Lobos”. Nota de pesquisa: É uma fotocópia de periódico Diário de La Marina com a legenda “UNAS FRASES DE HECTOR VILLALOBOS. El más grande compositor del Brasil, Hector VillaLobos, actualmente em Caracas, nos envía, com su amable dedicatória, unas frases que copiamos a continuación: ‘Um buen tabaco me hace recordar Cuba. Yo fumo tabaco todos los dias y para siempre’”.",2004.16.056,Fotografia||Villa-Lobos
1491,,10 Comunicação > 10.1 Documento,Não identificado,04/01/1954,"Com a dedicatória no verso “À querida mamãe para que se delicie com a nossa gozada gargalhada. A fotografia saiu tremida, mas julgamos que poderia interessá-la, por isso aqui vai ela. Beijos e abraços dos filhos saudosos. Villa-Lobos. New York, 4/1/1954”.",1977.16.126,Fotografia||Villa-Lobos e Arminda
1492,,10 Comunicação > 10.1 Documento,Não identificado,11/12/1953,,1983.16.139,Fotografia||Villa-Lobos regendo o soprano Iris Burguet e orquestra desconhecida
1493,Cuba > Havana,10 Comunicação > 10.1 Documento,Não identificado,11/12/1953,,1977.16.267,"Fotografia||Villa-Lobos, a soprano Iris Burguet e Orquestra Filarmônica de Havana"
1494,,10 Comunicação > 10.1 Documento,Não identificado,10/12/1953,,2003.16.136,"Fotografia||Da dir. para esq.: não identificado, Felicja Blumental Mizne, Annette Celine Mizne, Marcus Mizne, Arminda, o regente Hans Swarosky, a produtora da Radio Rot-Weiss - Madame Lobenstein, Villa-Lobos e Doris Swaroswsky"
1495,,10 Comunicação > 10.1 Documento,Não identificado,10/12/1953,,1977.16.311,"Fotografia||Da dir. para esq.: não identificado, Felicja Blumental Mizne, Annette Celine Mizne, Marcus Mizne, Arminda, o regente Hans Swarowsky, a produtora da Radio Rot-Weiss - Madame Lobenstein, Villa-Lobos e Doris Swaroswsky"
1496,,10 Comunicação > 10.1 Documento,Não identificado,30/11/1953,"Maestro e compositor Aldo Krieger recebendo o diploma de Julieta Strutt. José Vieira Brandão (ao fundo), Andrade Muricy (inclinado à dir. de Julieta), Otávio Vieira Brandão (à esq. de Julieta) e Villa-Lobos.",2004.16.052,"Fotografia||Formatura dos alunos do Conservatório Nacional de Canto Orfeônico, na Associação Brasileira de Imprensa - ABI"
1497,,10 Comunicação > 10.1 Documento,Não identificado,07/11/1953,,1982.16.266,Fotografia||Villa-Lobos por ocasião da entrega do título de Professor Honoris Causa do Instituto de Belas Artes do Rio Grande do Sul
1498,,10 Comunicação > 10.1 Documento,Não identificado,17/10/1953,,1984.16.051,"Fotografia||Villa-Lobos entre Castro Filho e Moura (terno claro) e Orlando Calaza (terno escuro), e Arminda ao lado do embaixador Labieno Salgado dos Santos, em almoço no salão do Clube Ginástico Português por ocasião da entrega do Troféu Carlos Gomes"
1499,,10 Comunicação > 10.1 Documento,Não identificado,17/10/1953,"Na mesa principal da esquerda para direita: Iberê Gomes Grosso (2º), Octacílio Braga (4º), embaixador Labeano Salgado dos Santos (5º), Arminda (6ª), Orlando Calaza (7º), Villa-Lobos (8º), Castro Filho e Moura (9º), Rodrigo Octavio Filho (10º), Gastón Talani (13º)",1983.16.134,Fotografia||Almoço no salão do Ginástico Português por ocasião da entrega do Troféu Carlos Gomes
1500,,10 Comunicação > 10.1 Documento,Não identificado,17/10/1953,,1983.16.117,"Fotografia||Villa-Lobos entre Castro Filho e Moura, terno claro, e Orlando Calaza, terno escuro, e Arminda ao lado do embaixador Labieno Salgado dos Santos, em almoço no salão do Clube Ginástico Português por ocasião da entrega do Troféu Carlos Gomes"
1501,,10 Comunicação > 10.1 Documento,Não identificado,17/10/1953,,1983.16.102,"Fotografia||Villa-Lobos recebendo a estatueta Carlos Gomes, o professor Castro Filho e Moura, de pé, Orlando Calaza, sentado entre Arminda e VL, embaixador Labieno Salgado dos Santos, sentado de terno claro, no salão do Ginástico Português"
1502,,10 Comunicação > 10.1 Documento,Não identificado,17/10/1953,,1983.16.040,"Fotografia||Villa-Lobos recebendo Troféu Carlos Gomes das mãos do professor Castro Filho e Moura, no salão do Ginástico Português"
1503,,10 Comunicação > 10.1 Documento,Não identificado,14/10/1953,"Da dir. para esq., na fila da frente: Helena Lorenzo Fernandez (1ª - de bolero de renda), Elzira Amabile (2ª), Luiz Amabile (3º), Villa-Lobos (4º), Tancredo Neves (5º), Julieta Strutt (6ª - um pouco atrás de Tancredo Neves), Arminda (7ª), Lúcia Branco (8ª). Na fila de trás: a pianista Ecléa Ribeiro (de laço no pescoço, atrás de Helena Lorenzo Fernandez), jornalista e imortal da ABL Peregrino Junior (atrás de Luiz Amabile), Cristina Maristany (atrás de Villa-Lobos).",2008.16.045,Fotografia||Homenagem da Academia de Música Lorenzo Fernandez ao compositor Villa-Lobos - inauguração do auditório Villa-Lobos
1504,,10 Comunicação > 10.1 Documento,Não identificado,14/10/1953,,1983.16.027,"Fotografia||Villa-Lobos, Tancredo Neves, Helena Lorenzo Fernandez, não identificada e a professora Lúcia Branco, por ocasião de homenagem da Academia de Música Lorenzo Fernandez ao compositor. Inauguração do auditório Villa-Lobos"
1505,,10 Comunicação > 10.1 Documento,Não identificado,14/10/1953,,1980.16.122,Fotografia||Villa-Lobos homenageado pela Academia de Música Lorenzo Fernandez
1506,Argentina > Buenos Aires,10 Comunicação > 10.1 Documento,Não identificado,09/11/1953,,1977.16.124,"Fotografia||Villa-Lobos e Arminda com Alberto Ginastera, de óculos, e o 1º trombone da Orquestra do Teatro Colón"
1507,,10 Comunicação > 10.1 Documento,Não identificado,31/07/1953,,2002.16.173,Fotografia||Conservatório Musical Villa-Lobos
1508,,10 Comunicação > 10.1 Documento,Não identificado,28/07/1953,,1983.16.022,Fotografia||Villa-Lobos e Bernardo Segall com músicos da Filarmônica de Los Angeles (Los Angeles Philharmonic) após ensaio geral no Hollywood Bowl
1509,,10 Comunicação > 10.1 Documento,Não identificado,28/07/1953,,1982.16.139,Fotografia||Villa-Lobos com músicos da Filarmônica de Los Angeles (Los Angeles Philharmonic) após ensaio geral no Hollywood Bowl
1510,EUA,10 Comunicação > 10.1 Documento,Não identificado,28/07/1953,,1977.16.242,Fotografia||Villa-Lobos e Bernardo Segall com músicos da Filarmônica de Los Angeles (Los Angeles Philharmonic) após ensaio geral no Hollywood Bowl
1511,,10 Comunicação > 10.1 Documento,Não identificado,22/06/1953,,1987.16.060,"Fotografia||Villa-Lobos, no Teatro Scala de Milão, regendo a orquestra do Teatro"
1512,,10 Comunicação > 10.1 Documento,Não identificado,22/06/1953,,1985.16.005,"Fotografia||Villa-Lobos, no Teatro Scala de Milão, regendo a Orchestra alla Scalla de Milano"
1513,Itália > Milão,10 Comunicação > 10.1 Documento,Não identificado,22/06/1953,,1977.16.123,"Fotografia||Villa-Lobos e a Orquestra do Teatro alla Scala de Milano, no Teatro Scala"
1514,Itália > Milão,10 Comunicação > 10.1 Documento,Não identificado,22/06/1953,,1977.16.122,"Fotografia||Villa-Lobos, no Teatro Scala de Milão, regendo a orquestra do Teatro"
1515,Suécia > Estocolmo,10 Comunicação > 10.1 Documento,Não identificado,29/04/1953,,1983.16.121,"Fotografia||Villa-Lobos e não identificada, funcionária da representação do Brsail na Suécia"
