,Descrição
69,", O Maracatu Nação foi inscrito, pelo Iphan, no Livro de Registro das Formas de Expressão, em dezembro de 2014. Com a grande maioria dos grupos concentrada nas comunidades de bairros periféricos da Região Metropolitana de Recife, também é conhecido como Maracatu de Baque Virado. Essa forma de expressão cultural apresenta um conjunto musical percussivo a um cortejo real, evocando ascoroações de reis e rainhas do antigo Congo africano.Os grupos apresentam um espetáculo repleto de simbologias e marcado pela riqueza estética e pela musicalidade, assim podem ser traduzidas as apresentações de grupos de maracatu, em Pernambuco. O momento de maior destaque consiste na saída às ruas para desfiles e apresentações no período carnavalesco., Para o Iphan, o valor patrimonial do Maracatu Nação reside sua capacidade de comunicar elementos da cultura brasileira e carregar elementos essenciais para a memória, a identidade e a formação da população afrobrasileira. Entendido como uma forma de expressão que congrega relações comunitárias, o Maracatu Nação permite o compartilhamento de práticas, memórias e fortes vínculos com o sagrado, evidenciadas por meio da relação desses grupos com os xangôs (denominação da religião dos orixás em Pernambuco) e a Jurema Sagrada (denominação da religião de características afro-ameríndias que cultua mestres e mestras, caboclos, entre outras entidades) e ainda pode remontar às antigas coroações de reis e rainhas congo., ,||Os batuqueiros fornecem a base rítmica para a composição do séquito real, com o Rei, a Rainha, o porta estandarte, as baianas, os arreamás e as calungas, entre outros"
70,", Inscrito pelo Iphan, em dezembro de 2014, no Livro de Registro das Formas de Expressão, o Maracatu de Baque Solto é uma expressão cultural também conhecida por maracatu de orquestra, maracatu de trombone, maracatu de baque singelo ou maracatu rural. Brincadeira popular que ocorre durante as comemorações do Carnaval e no período da Páscoa,tem comopersonagem central o Caboclo de Lança ecompõe-se por dança, música e poesia, e está associado ao ciclo canavieiro da Zona da Mata Norte de Pernambuco, especialmente, e às áreas sob sua influência cultural. Também ocorrem apresentações na Região Metropolitana do Recife e outras localidades. De seumovimento coreográfico surgeuma dança que evocao combate, e ao mesmo tempo relembraos movimentos dos trabalhadores nos canaviais., O Maracatu de Baque Solto ou Maracatu Rural envolve performances dramáticas, musicais e coreográficas, resultantes da fusão de manifestações populares (cambindas, bumba meu boi, cavalo-marinho e coroação dos reis de congo). O aspecto sagrado/religioso/ritualístico perpassa o folguedo durante todo o ano, em que se dão os ensaios ou sambadas, além das apresentações nos períodos carnavalesco e pascoal, caracterizando-o,fundamentalmente, como possuidor do ""segredo do brinquedo""., Os mais antigos maracatus foram criados em engenhos onde seus fundadores eram trabalhadores rurais, trabalhadores do canavial, cortadores de cana-de-açúcar, entre fins do século XIX e início do XX. A herança imaterial desse bem é legada aos contemporâneos por meio de gestos e indumentárias, nos ""pantins"" de caboclos e dos arreiamás, na dança das baianas, nas loas dos mestres, entre outros aspectos. Nas apresentações, o mestre de cada maracatu entoa loas em marchas, sambas e galope acompanhados do terno (as orquestras de sopro e percussão), enquanto no terreiro os caboclos, baianas e arreiamás se exibem fazendo suas evoluções., Possui forte tradição na palha da cana, sobretudo na Zona da Mata Norte, e mesmo convivendo com as adversidades decorrentes de tal contexto socioeconômico, os canavieiros construíram um vigoroso legado cultural, em que os maracatus de baque solto sobressaem. Sua singularidade se expressa por meio da sua musicalidade (um tipo de batuque ou baque solto), seus movimentos coreográficos e indumentária dos personagens, e pela riqueza de seus versos de improviso., ,||O baque solto está associado à forte musicalidade da região canavieira, em Pernambuco, entremeado pelo improviso e a rica coreografia dos arreiamás, caboclos e baianas"
71,", O Cavalo-Marinho é uma brincadeira popular, que envolve performances dramáticas, musicais e coreográficas, e foi inscritano Livro de Registro das Formas de Expressão, pelo Iphan, em dezembro de 2014. A manifestação cultural érealizada durante o ciclo natalino e seus brincadores são, em geral, trabalhadores da zona rural, concentradosprincipalmentena Zona da Mata do norte de Pernambuco e no sul da Paraíba. Contudo, sua práticanão ficou restrita a essas áreas e ecoatambémna Região Metropolitana de Recife e de João Pessoa, além de vários outros locais do País., No passado, o Cavalo-Marinho era realizado nos engenhos de cana-de-açúcar, onde seus participantes trabalhavam. Os conhecimentos relacionados a essa manifestação são passados entre as gerações de forma oral e, especialmente, durante a realização da brincadeira. Pode ser entendido como um grande teatro popular no qual são representadas as cenas do cotidiano (da vida presente e passada) dos seus participantes, do mundo do trabalho rural por meio de variado repertório musical, poesia, rituais, danças, linguagem corporal, personagens mascarados e bichos, como o boi e o cavalo (que dá nome à brincadeira). Contémainda alouvação ao Divino Santo Rei do Oriente e possui momentos em que há culto à Jurema Sagrada., O Cavalo-Marinho se realiza em um terreiro de chão plano e, geralmente, ao ar livre. A formação da brincadeira é em semicírculo com espaço para a plateia. Existe um grande número de elementos artístico-culturais e sócio-históricos que estão presentes na manifestação cultural, como, por exemplo, a presença de mestres e de personagens e os elementos da vivência do trabalho rural. Na brincadeira, constantemente são construídas novas identidades em cima da tradição. Mudança e continuidade não se excluem., Pode-se identificar diferentes ""estilos"" de brincar relacionados às linguagens, à introdução de mudanças por determinados mestres, entre outros fatores. Este bem cultural está em constante transformação a partir dos variados diálogos com brincadores e com o contexto em que se realiza, ou seja, o valor patrimonial do Cavalo-Marinho reside na sua capacidade de comunicar temporalidades, espacialidades, identidades e elementos da cultura brasileira tão diversa. Variante do Bumba meu boi, o Cavalo-Marinho é uma brincadeira composta por música, dança, poesia, coreografias e toadas. Reúne 76 personagens divididos em três categorias: animais, humanos e fantásticos. A música e o canto conduzem a trama e são executadas pelo banco, ou seja, o conjunto formado por rabeca, pandeiro, reco-recos e ganzá. As apresentações começam em junho e seguem até 6 de janeiro, quando a Igreja Católica celebra o Dia de Reis., , , \r\n, \r\nCertidão, \r\n||O folguedo pernambuco conhecido como Cavalo-marinho envolve dança, música, canto e a participação de figuras humanas, animais e fantásticas."
72,", O Teatro de Bonecos Popular do Nordeste- inscrito no Livro de Formas de Expressão, em março de 2015 - teve seu pedido de inclusão solicitado pela Associação Brasileira de Teatro de Bonecos (ABTB), o que mostra a tendência de uma apropriação da sociedade sobre suas manifestações. Os estados de Pernambuco, Paraíba, Ceará e Rio Grande do Norte, além do Distrito Federal, compõem a área de abrangência dessa manifestação cultural. Para o Iphan, esse bem imaterial não é um brinquedo ou um traço do folclore, e envolve, sobretudo, a produção de conhecimento criativo, artístico e com uma forte carga de representação teatral., O registro como Patrimônio Cultural Imaterial justifica-se devido àoriginalidade e tradição dessa expressão cênica, repassadas de mestre para discípulo, de pai para filho, de geração para geração. Uma tradição que revela uma das facetas da cultura brasileira, onde brincantes, por meio da arte dos bonecos, encenam histórias apreendidas na tradição que falam de relações sociais estabelecidas em um dado período da sociedade nordestina e de histórias que continuam revelando seu cotidiano, através dos novos enredos, personagens, música, linguagem verbal, das cores e da alegria que são inerentes ao seu contexto social., \r\n, Esse bem culturalimaterial é uma tradicional brincadeira, com origens no hibridismo cultural, durante o período de colonização do Brasil. Assim, pela representatividade que possui, é uma expressão teatral genuína da cultura brasileira e muito peculiar do Nordeste, rica da genialidade de seus criadores e da empatia que estabelece com seu público. A troca intensa possibilitou uma diversidade de temáticas: religiosa, profana ou de costumes populares., E, apesar desse bem ser amplamente conhecido como mamulengo, em cada contexto se desenvolveu de forma diferenciada e possui diversas denominações: Cassimiro Coco, no Maranhão e Ceará; João Redondo, no Rio Grande do Norte; Babau, na Paraíba; e Mamulengo, em Pernambuco. Carrega elementos fundamentais para a identidade e memória de seus praticantes e ainda desempenha um papel agregador que legitima as práticas cotidianas nesses locais., Visto comoreferência cultural que vem se atualizando, ao longo do tempo, enquanto permanecem as relações de tradição, pertencimento e coletividade no universo cultural na qual se desenvolve. A brincadeira é iniciada com a montagem da empanada, uma espécie de barraca. Emseguida, os brincantes se colocam na parte de trás e o espetáculo tem iníciocom os bonecos em cena e a introdução de um texto poético, a loa. Além da narrativa, a peça contém elementos surpresas, muitas vezes sugeridos pelo mestre bonequeiro. Normalmente, as sugestões ocorrem a partir de conhecimento prévio sobre o público., , , \r\n, \r\nCertidão, \r\n||Teatro de bonecos Recife"
73,"O Caboclinho foi reconhecido, em 24 de novembro de 2016, como Patrimônio Cultural do Brasil e inscrito, pelo Iphan, no Livro do Registro das Formas de Expressão. A manifestação cultural dos grupos de Caboclos, ou Caboclinhos, recebeu o registro de bem cultural imaterial por suas atividades no carnaval pernambucano desde o final do século XIX. Simboliza a memória do encontro cultural e da resistência, sobretudo das populações indígenas e também dos povos africanos escravizados, que reverberam profundamente na história do Nordeste rural brasileiro., As estruturas dramáticas desse bem imaterial reúnem elementos de dança e música, reelaboram narrativas de guerreiros e heróis que são capazes de conectar a vida cotidiana ao elemento mítico do caboclo brasileiro. A prática marcada por uma forte presença religiosa afro-indígena-brasileira está ancorada, principalmente, no culto à Jurema, com entidades espirituais denominadas Caboclos. Os instrumentos musicais são outra singularidade da expressão cultural, sendo o Caracaxá e a Preaca, por exemplo, exclusivos dos Caboclinhos., A ocorrência do Caboclinho se estende pelos estados de Alagoas, Pernambuco, Paraíba e Rio Grande do Norte, ficando como referência para proposta de Registro a Região Metropolitana de Recife e a Zona da Mata Norte de Pernambuco. Como ocorre em muitas expressões da cultura popular, a transmissão de saberes no Caboclinho está atrelada à observação e à prática, orientada pela transmissão oral de conhecimentos dos mais antigos na manifestação para os mais jovens."
74,"A Literatura de Cordel é um gênero literário, veículo de comunicação, ofício e meio de sobrevivência para inúmeros cidadãos brasileiros.||Literatura de Cordel||Literatura de Cordel||Entre versos, rimas e cantoria, a Literatura de Cordel é uma expressão cultural popular que abrange não apenas as letras, mas também a música e a ilustração.||Literatura de Cordel||Literatura de Cordel||Literatura de Cordel||Literatura de Cordel"
75,", Este bem cultural de natureza imaterial, inscrito no Livro dos Saberes em 2005, é uma prática tradicional de produção e venda, em tabuleiro, das chamadas comidas de baiana, feitas com azeite de dendê e ligadas ao culto dos orixás, amplamente disseminadas na cidade de Salvador, Bahia. Dentre as comidas de baiana destaca-se o acarajé, bolinho de feijão fradinho preparado de maneira artesanal, na qual o feijão é moído em um pilão de pedra (pedra de acarajé), temperado e posteriormente frito no azeite de dendê fervente. Sua receita tem origens no Golfo do Benim, na África Ocidental, tendo sido trazida para o Brasil com a vinda de escravos dessa região., O processo de instrução de ambos os bens culturais foi conduzido pelo Centro Nacional de Folclore e Cultura Popular (CNFCP), no âmbito do Projeto Celebrações e Saberes da Cultura Popular, proporcionado pelo PNPI. Este foi um projeto piloto desenvolvido pelo CNFCP para experimentar os instrumentos então criados para a salvaguarda do patrimônio imaterial; a saber: INRC e registro. No âmbito deste projeto foram desenvolvidos 14 inventários, conduzidos três registros. Tanto a instrução para o registro do ofício de baiana de acarajé como o dos saberes associados à viola de cocho foram integrados com projetos do CNFCP de apoio à produção de artesanato tradicional., A atividade de produção e comércio é predominantemente feminina, e encontra-se nos espaços públicos de Salvador, principalmente praças, ruas, feiras da cidade e orla marítima, como também nas festas de largo e outras celebrações que marcam a cultura da cidade. A indumentária das baianas, característica dos ritos do candomblé, constitui também um forte elemento de identificação desse ofício, sendo composta por turbantes, panos e colares de conta que simbolizam a intenção religiosa das baianas., Os aspectos referentes ao Ofício das Baianas de Acarajé e sua ritualização compreendem: o modo de fazer as comidas de baianas, com distinções referentes à oferta religiosa ou à venda informal em logradouros soteropolitanos; os elementos associados à venda como a indumentária própria da baiana, a preparação do tabuleiro e dos locais onde se instalam; os significados atribuídos pelas baianas ao seu ofício e os sentidos atribuídos pela sociedade local e nacional a esse elemento simbólico constituinte da identidade baiana., ,||A baiana de acarajé é um dos símbolos da ancestralidade africana na culinária brasileira."
76,", A Roda de Capoeira - inscrita no Livro de Registro das Formas de Expressão, em 2008 - é um elemento estruturante de umamanifestação cultural, espaço e tempo, onde se expressam simultaneamente o canto, o toque dos instrumentos, a dança, os golpes, o jogo, a brincadeira, os símbolos e rituais de herança africana - notadamente banto - recriados no Brasil. Profundamente ritualizada, a roda de capoeira congrega cantigas e movimentos que expressam uma visão de mundo, uma hierarquia e um código de ética que são compartilhados pelo grupo. Na roda de capoeira se batizam os iniciantes, se formam e se consagram os grandes mestres, se transmitem e se reiteram práticas e valores afro-brasileiros., O registro da Roda de Capoeira e Ofício dos Mestres de Capoeira tem amplitude nacional e foi realizado com base nas pesquisas desenvolvidas, durante a fase de inventário, nos estados da Bahia,Pernambuco e Rio de Janeiro. A capoeira é uma manifestação cultural presente hoje em todo o território brasileiro e em mais de 150 países, com variações regionais e locais criadas a partir de suas “modalidades” mais conhecidas: as chamadas “capoeira angola” e “capoeira regional”., O conhecimento produzidoparainstrução do processo permitiu identificar os principais aspectos que constituem a capoeira como prática cultural desenvolvida no Brasil: o saber transmitido pelos mestres formados na tradição da capoeira e como tal reconhecidos por seus pares; e a roda onde a capoeira reúne todos os seus elementos e se realiza de modo pleno.,  9ª Sessão do Comitê Intergovernamental para a Salvaguarda aprovou, em novembro de 2014, em Paris, a Roda de Capoeira, um dos símbolos do Brasil mais reconhecidos internacionalmente, como Patrimônio Cultural Imaterial da Humanidade. O reconhecimento da Roda de Capoeira, pela Unesco, é uma conquista muito importante para a cultura brasileira e expressa a história de resistência negra no Brasil, durante e após a escravidão.Originada no século XVII, em pleno período escravista, desenvolveu-se como forma de sociabilidade e solidariedade entre os africanos escravizados, estratégia para lidarem com o controle e a violência. Hoje, é um dos maiores símbolos da identidade brasileira e está presente em todo território nacional, além de praticada em mais de 160 países, em todos os continentes.,||Roda de capoeira com o Mestre José Carlos, em Santa Tereza no Rio de Janeiro||Roda de capoeira com o Mestre José Carlos, em Santa Tereza no Rio de Janeiro||Roda de capoeira com o Mestre José Carlos, em Santa Tereza no Rio de Janeiro||Aprendizado da capoeira, registrado pelo fotógrafo português Christiano Junior, no século XIX||Roda de capoeira com o Mestre José Carlos, em Santa Tereza no Rio de Janeiro||Roda de capoeira com o Mestre José Carlos, em Santa Tereza no Rio de Janeiro||As mãos do Mestre Curió tocando o berimbau, na Bahia"
77,"\r\n, O Ofício dos Mestres de Capoeira, inscrito no Livro de Registro dos Saberes, em 2008. é exercido por aqueles detentores dos conhecimentos tradicionais dessa manifestação e responsáveis pela transmissão de suas práticas, rituais e herança cultural. O saber da capoeira é transmitido de modo oral e gestual, de forma participativa e interativa, nas rodas, nas ruas e nas academias, assim como nas relações de sociabilidade e familiaridade construídas entre mestres e aprendizes. A capoeira é largamente difundida no Brasil e no mundo, a capoeira depende da manutenção da cadeia de transmissão desses mestres para sua continuidade como manifestação cultural., A capoeira é uma manifestação cultural presente hoje em todo o território brasileiro e em mais de 150 países, com variações regionais e locais criadas a partir de suas “modalidades” mais conhecidas: as chamadas “capoeira angola” e “capoeira regional”. O conhecimento produzido para a instrução do processo permitiu identificar os principais aspectos que constituem a capoeira como prática cultural desenvolvida no Brasil: o saber transmitido pelos mestres formados na tradição da capoeira e como tal reconhecidos por seus pares; e a roda onde a capoeira reúne todos os seus elementos e se realiza de modo pleno., Esse ofício é exercido por aqueles detentores dos conhecimentos tradicionais desta manifestação e responsáveis pela transmissão oral das suas práticas, rituais e herança cultural. O registro do Ofício dos Mestres de Capoeira tem amplitude nacional e foi realizado com base nas pesquisas desenvolvidas, durante a fase de inventário, nos estados da Bahia, de Pernambuco e do Rio de Janeiro. Os principais aspectos da capoeira como prática cultural desenvolvida no Brasil são o saber transmitido pelos mestres formados na tradição da capoeira e como tal reconhecidos por seus pares; e a roda onde a capoeira reúne todos os seus elementos e se realiza de modo pleno., Foram, também, os mestres brasileiros os responsáveis por articular aspectos culturais a uma manifestação que poderia ficar restrita à face marcial, mas que, ao contrário, é reconhecida por sua riqueza musical e gestual, o que a aproxima também de uma dança especial, reminiscência de jogos de combate de sociedades tradicionais. A roda de capoeira é a forma de expressão que permitiu o aprendizado e a expansão do jogo. Nela se encenam golpes e movimentos acrobáticos, cânticos antigos são reatualizados e outros são inventados, acompanhados por uma orquestra de instrumentos que produz uma sonoridade múltipla e, ao mesmo tempo, característica da arte., , , \r\n, \r\n, \r\n, \r\n||TT"
78,", \r\nA Produção Tradicional e Práticas Socioculturais Associadas à Cajuína no Piauí foi inscrita no Livro de Registro dos Saberes, pelo Iphan, em maio de 2014. O modo de fazer e as práticas socioculturais associadas à cajuína são bens imateriais devido, em grande parte, a sua imersão nos rituais de hospitalidade das famílias no Piauí. O consumo da cajuína é um ato de degustação, geralmente acompanhado de comentários e comparações sobre as qualidades daquela garrafa da bebida, ressaltando sua cor, doçura, cristalinidade, leveza ou densidade, qualidades que derivam tanto do caju escolhido quanto das técnicas de cada produtor., Essas referências revelam o sentimento de pertencimento do grupo ou família produtora e reforçam os laços entre os membros das redes familiares por onde a cajuína circula. As garrafas de cajuína, atualmente também vendidas, eram, na maior parte das vezes, dadas de presente ou servidas às visitas e oferecidas em aniversários, casamentos e outras comemorações. O modo artesanal de produzir a cajuína - bebida genuinamente piauiense - é considerado de relevante interesse cultural para o Piauí, onde a população comemora a safra do caju., Desenvolvido ao longo do tempo, esse modo - ainda que seja semelhante nos diversos núcleos produtores espalhados por todo o Piauí - apresenta características diferentes em cada núcleo, com melhorias e aperfeiçoamento de técnicas específicas que podem produzir determinadas diferenças no seu produto final, distinguindo o sabor da sua bebida da dos demais produtores. O controle de cada uma das etapas de produção se reflete na qualidade de cada garrafa. A essas referências se direciona o sentimento de pertencimento daquele grupo ou família produtora.||A cajuína  apresenta aparência e sabor decorrente do cuidado na escolha da matéria prima e habilidade no seu preparo."
79,"A Literatura de Cordel é um gênero literário, veículo de comunicação, ofício e meio de sobrevivência para inúmeros cidadãos brasileiros.||Literatura de Cordel||Literatura de Cordel||Entre versos, rimas e cantoria, a Literatura de Cordel é uma expressão cultural popular que abrange não apenas as letras, mas também a música e a ilustração.||Literatura de Cordel||Literatura de Cordel||Literatura de Cordel||Literatura de Cordel"
80,", Este bem cultural de natureza imaterial, inscrito no Livro dos Saberes em 2005, é uma prática tradicional de produção e venda, em tabuleiro, das chamadas comidas de baiana, feitas com azeite de dendê e ligadas ao culto dos orixás, amplamente disseminadas na cidade de Salvador, Bahia. Dentre as comidas de baiana destaca-se o acarajé, bolinho de feijão fradinho preparado de maneira artesanal, na qual o feijão é moído em um pilão de pedra (pedra de acarajé), temperado e posteriormente frito no azeite de dendê fervente. Sua receita tem origens no Golfo do Benim, na África Ocidental, tendo sido trazida para o Brasil com a vinda de escravos dessa região., O processo de instrução de ambos os bens culturais foi conduzido pelo Centro Nacional de Folclore e Cultura Popular (CNFCP), no âmbito do Projeto Celebrações e Saberes da Cultura Popular, proporcionado pelo PNPI. Este foi um projeto piloto desenvolvido pelo CNFCP para experimentar os instrumentos então criados para a salvaguarda do patrimônio imaterial; a saber: INRC e registro. No âmbito deste projeto foram desenvolvidos 14 inventários, conduzidos três registros. Tanto a instrução para o registro do ofício de baiana de acarajé como o dos saberes associados à viola de cocho foram integrados com projetos do CNFCP de apoio à produção de artesanato tradicional., A atividade de produção e comércio é predominantemente feminina, e encontra-se nos espaços públicos de Salvador, principalmente praças, ruas, feiras da cidade e orla marítima, como também nas festas de largo e outras celebrações que marcam a cultura da cidade. A indumentária das baianas, característica dos ritos do candomblé, constitui também um forte elemento de identificação desse ofício, sendo composta por turbantes, panos e colares de conta que simbolizam a intenção religiosa das baianas., Os aspectos referentes ao Ofício das Baianas de Acarajé e sua ritualização compreendem: o modo de fazer as comidas de baianas, com distinções referentes à oferta religiosa ou à venda informal em logradouros soteropolitanos; os elementos associados à venda como a indumentária própria da baiana, a preparação do tabuleiro e dos locais onde se instalam; os significados atribuídos pelas baianas ao seu ofício e os sentidos atribuídos pela sociedade local e nacional a esse elemento simbólico constituinte da identidade baiana., ,||A baiana de acarajé é um dos símbolos da ancestralidade africana na culinária brasileira."
