,Descrição
115,"\r\n, O Jongo no Sudeste é uma forma de expressão afro-brasileira que integra percussão de tambores, dança coletiva e elementos de espiritualidade. É praticado nos quintais das periferias urbanas e em algumas comunidades rurais do sudeste brasileiro. Foi inscrito no Livro das Formas de Expressão em 2005. Nessa região,é praticado nos estados do Espírito Santo, Rio de Janeiro, São Paulo e Minas Gerais. Ao longo do processo de Registro, comunidades manifestaram o desejo de participar da discussão: jongo de Campos, tambor da Fazenda Machadinha em Quissamã e jongo de Porciúncula (RJ), jongo de São José dos Campos (SP), jongo de Carangola (MG) e de Presidente Kennedy (ES)., Os atuais jongueiros são, geralmente, descendentes de jongueiros. Vivem em bairros pobres das cidades, onde são trabalhadores - ativos ou aposentados - e estudantes. Ali se radicaram seus avós e bisavós no período pós-abolicionista, em zonas intermédias entre campo e cidade. Alguns deles, nascidos na primeira metade do século 20, fizeram um percurso migratório entre o local de origem, geralmente uma vila ou área rural, e a cidade onde moram agora., Guardam lembranças vívidas das rodas que viam quando crianças, dos cantos que ouviam e das histórias que seus pais e avós contavam sobre o jongo. Acontece nas festas de santos católicos e divindades afro-brasileiras, nas festas juninas, nas festas do Divino, no dia 13 de maio (Dia da Abolição da Escravatura). É uma forma de louvação aos antepassados, consolidação de tradições e afirmação de identidades, com suas raízes nos saberes, ritos e crenças dos povos africanos, principalmente os de língua bantu. São sugestivos dessas origens o profundo respeito aos ancestrais, a valorização dos enigmas cantados e o elemento coreográfico da umbigada., No Brasil, o jongo consolidou-se entre os escravos que trabalhavam nas lavouras de café e cana-de-açúcar, no sudeste brasileiro, principalmente no vale do Rio Paraíba. Trata-se de uma forma de comunicação desenvolvida no contexto da escravidão e que serviu também como estratégia de sobrevivência e de circulação de informações codificadas sobre fatos acontecidos entre os antigos escravos por meio de pontos que os capatazes e senhores não conseguiam compreender. O Jongo sempre esteve, assim, em uma dimensão marginal onde os negros falam de si, de sua comunidade, através da crônica e da linguagem cifrada. É também conhecido pelos nomes de tambu, batuque, tambor e caxambu, dependendo da comunidade que o pratica.,||Acervo Iphan"
116,", Este bem cultural de natureza imaterial, inscrito no Livro dos Saberes em 2005, é uma prática tradicional de produção e venda, em tabuleiro, das chamadas comidas de baiana, feitas com azeite de dendê e ligadas ao culto dos orixás, amplamente disseminadas na cidade de Salvador, Bahia. Dentre as comidas de baiana destaca-se o acarajé, bolinho de feijão fradinho preparado de maneira artesanal, na qual o feijão é moído em um pilão de pedra (pedra de acarajé), temperado e posteriormente frito no azeite de dendê fervente. Sua receita tem origens no Golfo do Benim, na África Ocidental, tendo sido trazida para o Brasil com a vinda de escravos dessa região., O processo de instrução de ambos os bens culturais foi conduzido pelo Centro Nacional de Folclore e Cultura Popular (CNFCP), no âmbito do Projeto Celebrações e Saberes da Cultura Popular, proporcionado pelo PNPI. Este foi um projeto piloto desenvolvido pelo CNFCP para experimentar os instrumentos então criados para a salvaguarda do patrimônio imaterial; a saber: INRC e registro. No âmbito deste projeto foram desenvolvidos 14 inventários, conduzidos três registros. Tanto a instrução para o registro do ofício de baiana de acarajé como o dos saberes associados à viola de cocho foram integrados com projetos do CNFCP de apoio à produção de artesanato tradicional., A atividade de produção e comércio é predominantemente feminina, e encontra-se nos espaços públicos de Salvador, principalmente praças, ruas, feiras da cidade e orla marítima, como também nas festas de largo e outras celebrações que marcam a cultura da cidade. A indumentária das baianas, característica dos ritos do candomblé, constitui também um forte elemento de identificação desse ofício, sendo composta por turbantes, panos e colares de conta que simbolizam a intenção religiosa das baianas., Os aspectos referentes ao Ofício das Baianas de Acarajé e sua ritualização compreendem: o modo de fazer as comidas de baianas, com distinções referentes à oferta religiosa ou à venda informal em logradouros soteropolitanos; os elementos associados à venda como a indumentária própria da baiana, a preparação do tabuleiro e dos locais onde se instalam; os significados atribuídos pelas baianas ao seu ofício e os sentidos atribuídos pela sociedade local e nacional a esse elemento simbólico constituinte da identidade baiana., ,||A baiana de acarajé é um dos símbolos da ancestralidade africana na culinária brasileira."
117,", A Roda de Capoeira - inscrita no Livro de Registro das Formas de Expressão, em 2008 - é um elemento estruturante de umamanifestação cultural, espaço e tempo, onde se expressam simultaneamente o canto, o toque dos instrumentos, a dança, os golpes, o jogo, a brincadeira, os símbolos e rituais de herança africana - notadamente banto - recriados no Brasil. Profundamente ritualizada, a roda de capoeira congrega cantigas e movimentos que expressam uma visão de mundo, uma hierarquia e um código de ética que são compartilhados pelo grupo. Na roda de capoeira se batizam os iniciantes, se formam e se consagram os grandes mestres, se transmitem e se reiteram práticas e valores afro-brasileiros., O registro da Roda de Capoeira e Ofício dos Mestres de Capoeira tem amplitude nacional e foi realizado com base nas pesquisas desenvolvidas, durante a fase de inventário, nos estados da Bahia,Pernambuco e Rio de Janeiro. A capoeira é uma manifestação cultural presente hoje em todo o território brasileiro e em mais de 150 países, com variações regionais e locais criadas a partir de suas “modalidades” mais conhecidas: as chamadas “capoeira angola” e “capoeira regional”., O conhecimento produzidoparainstrução do processo permitiu identificar os principais aspectos que constituem a capoeira como prática cultural desenvolvida no Brasil: o saber transmitido pelos mestres formados na tradição da capoeira e como tal reconhecidos por seus pares; e a roda onde a capoeira reúne todos os seus elementos e se realiza de modo pleno.,  9ª Sessão do Comitê Intergovernamental para a Salvaguarda aprovou, em novembro de 2014, em Paris, a Roda de Capoeira, um dos símbolos do Brasil mais reconhecidos internacionalmente, como Patrimônio Cultural Imaterial da Humanidade. O reconhecimento da Roda de Capoeira, pela Unesco, é uma conquista muito importante para a cultura brasileira e expressa a história de resistência negra no Brasil, durante e após a escravidão.Originada no século XVII, em pleno período escravista, desenvolveu-se como forma de sociabilidade e solidariedade entre os africanos escravizados, estratégia para lidarem com o controle e a violência. Hoje, é um dos maiores símbolos da identidade brasileira e está presente em todo território nacional, além de praticada em mais de 160 países, em todos os continentes.,||Roda de capoeira com o Mestre José Carlos, em Santa Tereza no Rio de Janeiro||Roda de capoeira com o Mestre José Carlos, em Santa Tereza no Rio de Janeiro||Roda de capoeira com o Mestre José Carlos, em Santa Tereza no Rio de Janeiro||Aprendizado da capoeira, registrado pelo fotógrafo português Christiano Junior, no século XIX||Roda de capoeira com o Mestre José Carlos, em Santa Tereza no Rio de Janeiro||Roda de capoeira com o Mestre José Carlos, em Santa Tereza no Rio de Janeiro||As mãos do Mestre Curió tocando o berimbau, na Bahia"
118,"\r\n, O Ofício dos Mestres de Capoeira, inscrito no Livro de Registro dos Saberes, em 2008. é exercido por aqueles detentores dos conhecimentos tradicionais dessa manifestação e responsáveis pela transmissão de suas práticas, rituais e herança cultural. O saber da capoeira é transmitido de modo oral e gestual, de forma participativa e interativa, nas rodas, nas ruas e nas academias, assim como nas relações de sociabilidade e familiaridade construídas entre mestres e aprendizes. A capoeira é largamente difundida no Brasil e no mundo, a capoeira depende da manutenção da cadeia de transmissão desses mestres para sua continuidade como manifestação cultural., A capoeira é uma manifestação cultural presente hoje em todo o território brasileiro e em mais de 150 países, com variações regionais e locais criadas a partir de suas “modalidades” mais conhecidas: as chamadas “capoeira angola” e “capoeira regional”. O conhecimento produzido para a instrução do processo permitiu identificar os principais aspectos que constituem a capoeira como prática cultural desenvolvida no Brasil: o saber transmitido pelos mestres formados na tradição da capoeira e como tal reconhecidos por seus pares; e a roda onde a capoeira reúne todos os seus elementos e se realiza de modo pleno., Esse ofício é exercido por aqueles detentores dos conhecimentos tradicionais desta manifestação e responsáveis pela transmissão oral das suas práticas, rituais e herança cultural. O registro do Ofício dos Mestres de Capoeira tem amplitude nacional e foi realizado com base nas pesquisas desenvolvidas, durante a fase de inventário, nos estados da Bahia, de Pernambuco e do Rio de Janeiro. Os principais aspectos da capoeira como prática cultural desenvolvida no Brasil são o saber transmitido pelos mestres formados na tradição da capoeira e como tal reconhecidos por seus pares; e a roda onde a capoeira reúne todos os seus elementos e se realiza de modo pleno., Foram, também, os mestres brasileiros os responsáveis por articular aspectos culturais a uma manifestação que poderia ficar restrita à face marcial, mas que, ao contrário, é reconhecida por sua riqueza musical e gestual, o que a aproxima também de uma dança especial, reminiscência de jogos de combate de sociedades tradicionais. A roda de capoeira é a forma de expressão que permitiu o aprendizado e a expansão do jogo. Nela se encenam golpes e movimentos acrobáticos, cânticos antigos são reatualizados e outros são inventados, acompanhados por uma orquestra de instrumentos que produz uma sonoridade múltipla e, ao mesmo tempo, característica da arte., , , \r\n, \r\n, \r\n, \r\n||TT"
119,"\r\n, O Jongo no Sudeste é uma forma de expressão afro-brasileira que integra percussão de tambores, dança coletiva e elementos de espiritualidade. É praticado nos quintais das periferias urbanas e em algumas comunidades rurais do sudeste brasileiro. Foi inscrito no Livro das Formas de Expressão em 2005. Nessa região,é praticado nos estados do Espírito Santo, Rio de Janeiro, São Paulo e Minas Gerais. Ao longo do processo de Registro, comunidades manifestaram o desejo de participar da discussão: jongo de Campos, tambor da Fazenda Machadinha em Quissamã e jongo de Porciúncula (RJ), jongo de São José dos Campos (SP), jongo de Carangola (MG) e de Presidente Kennedy (ES)., Os atuais jongueiros são, geralmente, descendentes de jongueiros. Vivem em bairros pobres das cidades, onde são trabalhadores - ativos ou aposentados - e estudantes. Ali se radicaram seus avós e bisavós no período pós-abolicionista, em zonas intermédias entre campo e cidade. Alguns deles, nascidos na primeira metade do século 20, fizeram um percurso migratório entre o local de origem, geralmente uma vila ou área rural, e a cidade onde moram agora., Guardam lembranças vívidas das rodas que viam quando crianças, dos cantos que ouviam e das histórias que seus pais e avós contavam sobre o jongo. Acontece nas festas de santos católicos e divindades afro-brasileiras, nas festas juninas, nas festas do Divino, no dia 13 de maio (Dia da Abolição da Escravatura). É uma forma de louvação aos antepassados, consolidação de tradições e afirmação de identidades, com suas raízes nos saberes, ritos e crenças dos povos africanos, principalmente os de língua bantu. São sugestivos dessas origens o profundo respeito aos ancestrais, a valorização dos enigmas cantados e o elemento coreográfico da umbigada., No Brasil, o jongo consolidou-se entre os escravos que trabalhavam nas lavouras de café e cana-de-açúcar, no sudeste brasileiro, principalmente no vale do Rio Paraíba. Trata-se de uma forma de comunicação desenvolvida no contexto da escravidão e que serviu também como estratégia de sobrevivência e de circulação de informações codificadas sobre fatos acontecidos entre os antigos escravos por meio de pontos que os capatazes e senhores não conseguiam compreender. O Jongo sempre esteve, assim, em uma dimensão marginal onde os negros falam de si, de sua comunidade, através da crônica e da linguagem cifrada. É também conhecido pelos nomes de tambu, batuque, tambor e caxambu, dependendo da comunidade que o pratica.,||Acervo Iphan"
120,", Este bem cultural de natureza imaterial, inscrito no Livro dos Saberes em 2005, é uma prática tradicional de produção e venda, em tabuleiro, das chamadas comidas de baiana, feitas com azeite de dendê e ligadas ao culto dos orixás, amplamente disseminadas na cidade de Salvador, Bahia. Dentre as comidas de baiana destaca-se o acarajé, bolinho de feijão fradinho preparado de maneira artesanal, na qual o feijão é moído em um pilão de pedra (pedra de acarajé), temperado e posteriormente frito no azeite de dendê fervente. Sua receita tem origens no Golfo do Benim, na África Ocidental, tendo sido trazida para o Brasil com a vinda de escravos dessa região., O processo de instrução de ambos os bens culturais foi conduzido pelo Centro Nacional de Folclore e Cultura Popular (CNFCP), no âmbito do Projeto Celebrações e Saberes da Cultura Popular, proporcionado pelo PNPI. Este foi um projeto piloto desenvolvido pelo CNFCP para experimentar os instrumentos então criados para a salvaguarda do patrimônio imaterial; a saber: INRC e registro. No âmbito deste projeto foram desenvolvidos 14 inventários, conduzidos três registros. Tanto a instrução para o registro do ofício de baiana de acarajé como o dos saberes associados à viola de cocho foram integrados com projetos do CNFCP de apoio à produção de artesanato tradicional., A atividade de produção e comércio é predominantemente feminina, e encontra-se nos espaços públicos de Salvador, principalmente praças, ruas, feiras da cidade e orla marítima, como também nas festas de largo e outras celebrações que marcam a cultura da cidade. A indumentária das baianas, característica dos ritos do candomblé, constitui também um forte elemento de identificação desse ofício, sendo composta por turbantes, panos e colares de conta que simbolizam a intenção religiosa das baianas., Os aspectos referentes ao Ofício das Baianas de Acarajé e sua ritualização compreendem: o modo de fazer as comidas de baianas, com distinções referentes à oferta religiosa ou à venda informal em logradouros soteropolitanos; os elementos associados à venda como a indumentária própria da baiana, a preparação do tabuleiro e dos locais onde se instalam; os significados atribuídos pelas baianas ao seu ofício e os sentidos atribuídos pela sociedade local e nacional a esse elemento simbólico constituinte da identidade baiana., ,||A baiana de acarajé é um dos símbolos da ancestralidade africana na culinária brasileira."
121,", A produção artesanal do queijo de leite crurepresenta uma alternativa bem sucedida de conservação e aproveitamento da produção leiteira regional, em áreas cuja geografia limita o escoamento dessa produção., Em cada uma das regiões, os detentores do conhecimento forjaram um modo de fazer próprio, expresso na forma de manipulação do leite, dos coalhos e das massas, na prensagem, no tempo de maturação (cura), conferindo a cada queijo aparência e sabor específicos. Nessa diversidade constituem aspectos comuns o uso de leite cru e a adição do pingo, um fermento láctico natural, recolhido a partir do soro que drena do próprio queijo e que lhe transfere as características específicas, condicionadas pelo tipo de solo, pelo clima e pela vegetação de cada região., Como todo queijo artesanal feito no Brasil, as bases originais do modode fazer queijo nas Gerais, vêm da tradição portuguesa da Serra da Estrela, na região central de Portugal.E, como todo produto cultural, ao longo do tempo transformou-se dinamicamente e buscou aderir-se àrealidade local, fundamentando estruturas, instrumentos, técnicas e fazeresque lhes são próprios., , , \r\n, \r\n, \r\n, \r\n, \r\n, , \r\n, \r\n, \r\n,  - , \r\n, \r\n||O modo artesanal de fazer queijo de Minas envolve o processo de cura."
122,", A Roda de Capoeira - inscrita no Livro de Registro das Formas de Expressão, em 2008 - é um elemento estruturante de umamanifestação cultural, espaço e tempo, onde se expressam simultaneamente o canto, o toque dos instrumentos, a dança, os golpes, o jogo, a brincadeira, os símbolos e rituais de herança africana - notadamente banto - recriados no Brasil. Profundamente ritualizada, a roda de capoeira congrega cantigas e movimentos que expressam uma visão de mundo, uma hierarquia e um código de ética que são compartilhados pelo grupo. Na roda de capoeira se batizam os iniciantes, se formam e se consagram os grandes mestres, se transmitem e se reiteram práticas e valores afro-brasileiros., O registro da Roda de Capoeira e Ofício dos Mestres de Capoeira tem amplitude nacional e foi realizado com base nas pesquisas desenvolvidas, durante a fase de inventário, nos estados da Bahia,Pernambuco e Rio de Janeiro. A capoeira é uma manifestação cultural presente hoje em todo o território brasileiro e em mais de 150 países, com variações regionais e locais criadas a partir de suas “modalidades” mais conhecidas: as chamadas “capoeira angola” e “capoeira regional”., O conhecimento produzidoparainstrução do processo permitiu identificar os principais aspectos que constituem a capoeira como prática cultural desenvolvida no Brasil: o saber transmitido pelos mestres formados na tradição da capoeira e como tal reconhecidos por seus pares; e a roda onde a capoeira reúne todos os seus elementos e se realiza de modo pleno.,  9ª Sessão do Comitê Intergovernamental para a Salvaguarda aprovou, em novembro de 2014, em Paris, a Roda de Capoeira, um dos símbolos do Brasil mais reconhecidos internacionalmente, como Patrimônio Cultural Imaterial da Humanidade. O reconhecimento da Roda de Capoeira, pela Unesco, é uma conquista muito importante para a cultura brasileira e expressa a história de resistência negra no Brasil, durante e após a escravidão.Originada no século XVII, em pleno período escravista, desenvolveu-se como forma de sociabilidade e solidariedade entre os africanos escravizados, estratégia para lidarem com o controle e a violência. Hoje, é um dos maiores símbolos da identidade brasileira e está presente em todo território nacional, além de praticada em mais de 160 países, em todos os continentes.,||Roda de capoeira com o Mestre José Carlos, em Santa Tereza no Rio de Janeiro||Roda de capoeira com o Mestre José Carlos, em Santa Tereza no Rio de Janeiro||Roda de capoeira com o Mestre José Carlos, em Santa Tereza no Rio de Janeiro||Aprendizado da capoeira, registrado pelo fotógrafo português Christiano Junior, no século XIX||Roda de capoeira com o Mestre José Carlos, em Santa Tereza no Rio de Janeiro||Roda de capoeira com o Mestre José Carlos, em Santa Tereza no Rio de Janeiro||As mãos do Mestre Curió tocando o berimbau, na Bahia"
123,"\r\n, O Ofício dos Mestres de Capoeira, inscrito no Livro de Registro dos Saberes, em 2008. é exercido por aqueles detentores dos conhecimentos tradicionais dessa manifestação e responsáveis pela transmissão de suas práticas, rituais e herança cultural. O saber da capoeira é transmitido de modo oral e gestual, de forma participativa e interativa, nas rodas, nas ruas e nas academias, assim como nas relações de sociabilidade e familiaridade construídas entre mestres e aprendizes. A capoeira é largamente difundida no Brasil e no mundo, a capoeira depende da manutenção da cadeia de transmissão desses mestres para sua continuidade como manifestação cultural., A capoeira é uma manifestação cultural presente hoje em todo o território brasileiro e em mais de 150 países, com variações regionais e locais criadas a partir de suas “modalidades” mais conhecidas: as chamadas “capoeira angola” e “capoeira regional”. O conhecimento produzido para a instrução do processo permitiu identificar os principais aspectos que constituem a capoeira como prática cultural desenvolvida no Brasil: o saber transmitido pelos mestres formados na tradição da capoeira e como tal reconhecidos por seus pares; e a roda onde a capoeira reúne todos os seus elementos e se realiza de modo pleno., Esse ofício é exercido por aqueles detentores dos conhecimentos tradicionais desta manifestação e responsáveis pela transmissão oral das suas práticas, rituais e herança cultural. O registro do Ofício dos Mestres de Capoeira tem amplitude nacional e foi realizado com base nas pesquisas desenvolvidas, durante a fase de inventário, nos estados da Bahia, de Pernambuco e do Rio de Janeiro. Os principais aspectos da capoeira como prática cultural desenvolvida no Brasil são o saber transmitido pelos mestres formados na tradição da capoeira e como tal reconhecidos por seus pares; e a roda onde a capoeira reúne todos os seus elementos e se realiza de modo pleno., Foram, também, os mestres brasileiros os responsáveis por articular aspectos culturais a uma manifestação que poderia ficar restrita à face marcial, mas que, ao contrário, é reconhecida por sua riqueza musical e gestual, o que a aproxima também de uma dança especial, reminiscência de jogos de combate de sociedades tradicionais. A roda de capoeira é a forma de expressão que permitiu o aprendizado e a expansão do jogo. Nela se encenam golpes e movimentos acrobáticos, cânticos antigos são reatualizados e outros são inventados, acompanhados por uma orquestra de instrumentos que produz uma sonoridade múltipla e, ao mesmo tempo, característica da arte., , , \r\n, \r\n, \r\n, \r\n||TT"
